"id","date","latitude","longitude","location","description","sources","associations"
"B65BHS","07/05/2024","46.049056","38.211738","Primorsko-Akhtarsk, Krasnodar Krai, Russia","6 year old reportedly killed after strike impacts residential building.","https://t.me/itsdonetsk/174062,https://t.me/itsdonetsk/174078,https://t.me/itsdonetsk/174085,https://www.1tv.ru/news/2024-07-05/480138-vsu_nanesli_udar_po_primorsko_ahtarsku_v_krasnodarskom_krae_pogibla_shestiletnyaya_devochka,https://www.m24.ru/news/proisshestviya/05072024/706008,https://ki-news.ru/news/v-primorsko-ahtarske-zhiteli-povrezhdennyh-ot-bpla-domov-dolzhny-vernutsya-v-kvartiry-v-noyabre/,https://ki-news.ru/news/v-primorsko-ahtarske-poyavilsya-stihijnyj-memorial-v-pamyat-o-pogibshej-devochke/,https://ki-news.ru/news/v-primorsko-ahtarske-otremontirovali-dom-postradavshij-v-rezultate-ataki-bpla/","Type of area affected=Residential,Weapon System=Loitering munition"
"2KRP4A","07/06/2024","48.208842","37.338195","Novohrodivka, Donetsk region","A damaged school and an impact crater on the road next to it after a reported strike. ","https://t.me/itsdonetsk/174586","Type of area affected=School or childcare,Type of area affected=Roads/Highways/Transport"
"H33E46","07/06/2024","46.313054","39.351595","Leningradskaya stanitsa, Krasnodar region","Oil depot on fire after a reported strike. ","https://t.me/XU_kraine/58694,https://t.me/opershtab23/8172","Type of area affected=Industrial"
"4M50DX","07/06/2024","46.64048","32.61853","Kherson","A cafe destroyed by fire after a reported strike in the city centre. ","https://t.me/XU_kraine/58705,https://t.me/suspilnekherson/46163","Type of area affected=Food/Food Infrastructure,Type of area affected=Commercial"
"AS54HB","07/08/2024","50.464405","30.471518","Kyiv","Several cruise missiles hit a residential area in central Kyiv.","https://t.me/k_dvizh/47047","Type of area affected=Residential,Weapon System=Cruise missile"
"YP7DI0","07/08/2024","48.326029","37.331927","Novoekonomichne, Donetsk oblast","Heavy damage to a church as a result of shelling.","https://t.me/yaaa_s_Donbassa/41140","Type of area affected=Religious,Weapon System=Unknown"
"OTAVH5","07/08/2024","48.294281","37.138779","Pokrovsk (Donetsk oblast)","At least three people reported killed as the result of the cluster munition attack. ","https://novosti.dn.ua/news/376886-rosiyany-obstrilyaly-pokrovsk-z-rszv-smerch-troye-zagyblyh-ta-dvoye-poranenyh,https://www.ukrinform.ua/rubric-regions/3883142-rosia-obstrilala-pokrovsk-iz-rszv-smerc-policia-pokazala-naslidki.html,https://x.com/UA__oleg/status/1810304389065605284,https://suspilne.media/donbas/786109-rozbivaut-use-so-nazito-ludmi-udar-armii-rf-8-lipna-po-pokrovsku-na-doneccini-aki-rujnuvanna/,https://www.instagram.com/tp.pokrovsk/reel/C9KBmqFt3fL/,https://t.me/donbass24_7/46235","Type of area affected=Commercial,Type of area affected=Industrial,Weapon System=Cluster munitions"
"3TVPSL","07/08/2024","48.158865","33.553243","Kryvyi Rih (Dnipropetrovsk oblast)","At least ten people reported killed and thirty injured as a result of the strike at the office building of the mining enterpise.","https://forbes.ua/news/rosiya-obstrilyala-kriviy-rig-raketa-vluchila-u-pivnichniy-gzk-08072024-22247,https://interfax.com.ua/news/general/998667.html,https://x.com/Halexyt/status/1810288160351391845,https://x.com/tsnua/status/1810277805856608434","Type of area affected=Industrial"
"WAO0E3","07/08/2024","50.449199","30.589668","Kyiv","Hospital damaged, at least four people reported killed and several injured.","https://x.com/KyivPost/status/1810266599447769344,https://x.com/Euan_MacDonald/status/1810269130248818912,https://x.com/KyivIndependent/status/1810270842233770396,https://x.com/JayinKyiv/status/1810266699280589216,https://t.me/huyovy_kharkiv/153310","Type of area affected=Healthcare,Weapon System=Unknown"
"A9LQZH","07/08/2024","50.462663","30.481949","Kyiv","Aftermath of the multiple missile attack in the area of Lukianivska metro station. Several buildings damaged.","https://x.com/twittterrhandle/status/1810242317434913247,https://x.com/JayinKyiv/status/1810268029109874977,https://x.com/Euan_MacDonald/status/1810230978700283936","Type of area affected=Residential,Type of area affected=Industrial,Type of area affected=Commercial,Type of area affected=Roads/Highways/Transport,Weapon System=Ballistic missile,Weapon System=Cruise missile"
"41IQAG","07/08/2024","50.478461","30.436612","Kyiv","Massive damage to a five-story apartment building as a result of the massive missile attack on the city.","https://t.me/truexanewsua/94650,https://t.me/c/1297540669/48719,https://x.com/blyskavka_ua/status/1810256980386214037,https://t.me/c/1394092619/69772,https://t.me/c/1394092619/69775,https://x.com/IrynaVoichuk/status/1810606812766314512,https://x.com/GLAVCOM_UA/status/1810566422491205843,https://zh.wikipedia.org/wiki/File:Residential_building_in_Kyiv_%28Shevchenkivskyi_District%29_after_Russian_attack,_2024-07-08_%2851%29.jpg,https://commons.wikimedia.org/wiki/File:Residential_building_in_Kyiv_%28Shevchenkivskyi_District%29_after_Russian_attack,_2024-07-08_%2801%29.jpg,https://kyivcity.gov.ua/photo/inspektsiya_budinku_na_vul_volodimira_salskogo_19_foto__kmda_mikhaylo_krivolapov/,https://vechirniy.kyiv.ua/news/100441/,https://tsn.ua/ru/exclusive/skandal-v-kieve-pochemu-lyudi-iz-razbomblennyh-domov-platyat-nekotorye-komuslugi-a-ih-kvartiry-do-sih-por-ne-vosstanovleny-2865092.html","Type of area affected=Residential,Weapon System=Ballistic missile,Weapon System=Cruise missile"
"M5DZBE","07/08/2024","50.451011","30.481609","Kyiv","Heavy damage to the children's hospital ""Okhmatdyt"" as a result of the massive missile attack.","https://x.com/United24media/status/1810228723972501527,https://x.com/igorlachenkov/status/1810231413725110296,https://x.com/nexta_tv/status/1810231829250679167,https://x.com/blyskavka_ua/status/1810232948605530541,https://x.com/olex_scherba/status/1810230531918864889,https://x.com/JayinKyiv/status/1810242076291809386,https://x.com/nexta_tv/status/1810281078633943087,https://x.com/olehbatkovych/status/1810277831840076093","Type of area affected=Healthcare,Weapon System=Ballistic missile,Weapon System=Cruise missile"
"NN6E8W","07/11/2024","49.590138","37.715133","Hlushkivka, Kharkiv region","Four people injured after a reported FAB-500 hits a farming enterprise.","https://t.me/prokuratura_kharkiv/17487,https://t.me/kharkivlife/90113,https://t.me/huyovy_kharkiv/153535,https://t.me/Bratchuk_Sergey/91973","Type of area affected=Food/Food Infrastructure,Weapon System=Air strike"
"0JNOJI","07/11/2024","46.651699","32.64453","Kherson","Shelling of a residential area; one of the first responders injured in a repeated shelling.","https://t.me/khersonskaODA/21735,https://t.me/hueviyherson/59491,https://t.me/hueviyherson/59492,https://t.me/kherson_non_fake/15933,https://t.me/kherson_miskrada/37054","Type of area affected=Residential,Type of area affected=Humanitarian,Type of area affected=Roads/Highways/Transport"
"9WQGFV","07/12/2024","47.989911","37.637838","Kirov, donetsk","Bus damaged and person wounded after UAV strike on bus.","https://t.me/itsdonetsk/176420,https://t.me/itsdonetsk/176433,https://t.me/itsdonetsk/176385,https://t.me/itsdonetsk/176416","Type of area affected=Roads/Highways/Transport,Weapon System=Loitering munition"
"X1D1A0","07/12/2024","48.262233","37.286845","Mirnograd in the Donetsk region","Schools and residential area damaged by strike. ","https://youtu.be/nuhuK6f4ED4?feature=shared,https://t.me/itsdonetsk/176333,https://t.me/itsdonetsk/176294","Type of area affected=Residential,Type of area affected=School or childcare,Weapon System=Unknown"
"UX4BVA","07/13/2024","49.888987","36.022247","Budy, Kharkiv region ","Two people reportedly killed and 23 injured including a child after two strikes on the train station. ","https://t.me/Nablydatel_Dozor/133722,https://x.com/Gabriele_M24/status/1812821413608522229","Type of area affected=Roads/Highways/Transport"
"LDUJER","07/15/2024","48.980665","37.803964","Lyman, Donetsk oblast","5 people reportedly killed in a strike which hit residential and commercial buildings.","https://t.me/kram_slav_forever/56121,https://zmina.info/en/news-en/russians-drop-two-guided-aerial-bombs-on-lyman-and-injure-five-people/,https://hromadske.ua/ru/voyna/227852-rossiyane-sbrosili-na-liman-250-kilogrammovye-uaby-raneny-pyat-chelovek?__cf_chl_tk=NSOs6Z5dGx0J8OVJBRBge7IBS_8rLAQe0Kwy54y6rAI-1766155493-1.0.1.1-FWVOaB4rzNHlG.Q4fPzjDKfQZMvWzVjq2ZyYjdzN.t4","Type of area affected=Residential,Type of area affected=Commercial,Weapon System=Unknown"
"YGXVWQ","07/17/2024","50.210473","36.319512","Kharkiv","Destroyed liceum after the reported strike.","https://t.me/truexakharkiv/47091","Type of area affected=School or childcare,Weapon System=Unknown"
"BQO6M4","07/17/2024","48.261738","37.186936","Pokrovsk, Donetsk region","Six people reportedly injured in a shelling.","https://t.me/mvs_ukraine/39969,https://www.facebook.com/photo?fbid=788992330054111&set=pcb.788993030054041","Type of area affected=Residential"
"FEVR87","07/18/2024","48.308493","37.260605","Myrnohrad, Donetsk region","Three people injured in a reported rocket strike. ","https://t.me/DonetskaODA/18032,https://censor.net/ua/photo_news/3500378/rosiyany_obstrilyaly_myrnograd_na_donechchyni_ye_poraneni","Type of area affected=Residential,Type of area affected=Administrative,Type of area affected=Industrial"
"7MBTDN","07/19/2024","50.772562","35.258026","Sumy","Warehouse destroyed after reported strike. ","https://t.me/itsdonetsk/178511?single","Type of area affected=Commercial,Weapon System=Unknown"
"B0WEWF","07/20/2024","48.258255","37.383907","Hrodivka, Donetsk region","School damaged after a reported strike. ","https://t.me/itsdonetsk/178613","Type of area affected=School or childcare,Weapon System=Unknown"
"C9F85C","07/20/2024","47.936369","37.670627","Donetsk","A tennis club and a bus depot damaged after a reported strike. ","https://t.me/itsdonetsk/178718,https://t.me/XU_kraine/59651,https://novosti.dn.ua/news/377574-v-okupovanomu-donetsku-obstrilyaly-avtobusnyj-park,https://novynarnia.com/2024/07/20/u-doneczku-prylit-po-avtobusnomu-parku-ta-tenisnomu-klubi-tam-jmovirno-bazuvalysya-rosijski-vijska/","Type of area affected=Roads/Highways/Transport,Type of area affected=Commercial"
"9E5SRA","07/22/2024","49.71009","37.6126","Kupyansk in the Kharkiv region","Commercial area damaged after strike. ","https://t.me/suspilne_kharkiv/43511,https://t.me/itsdonetsk/178495","Type of area affected=Commercial,Weapon System=Unknown"
"D0SWYT","07/24/2024","49.969428","36.35742","Kharkiv","Damaged deminers office and medical cars.","https://t.me/truexakharkiv/47313,https://t.me/suspilnenews/35910,https://t.me/huyovy_kharkiv/154583,https://t.me/huyovy_kharkiv/154595,https://www.instagram.com/p/C9zxzSjpt1g/","Type of area affected=Undefined,Type of area affected=Humanitarian,Type of area affected=Administrative,Weapon System=Unknown"
"4IRCNP","07/25/2024","50.160132","37.354083","Prykolotne, Kharkiv region","Aftermath of a strike on what appears to be a residential area.","https://t.me/kharkivlife/90899","Type of area affected=Residential,Type of area affected=School or childcare"
"4WVI9S","07/27/2024","51.677996","33.918607","Hlukhiv, Sumy region","A shop and vehicles damaged after a reported strike. 
","https://t.me/news_sumy24/47282","Type of area affected=Commercial"
"8YW1RL","07/31/2024","50.765756","35.544169","Ilek-Pen'kovka village, Belgorod Oblast","Moment of a drone strike on a building.","https://t.me/itsdonetsk/181908","Type of area affected=Undefined,Weapon System=Loitering munition"
"2K7RX6","08/01/2024","47.555008","34.403587","Nikopol","Two women, a mother and daughter, reportedly killed after strike on residential area.","https://t.me/other_nikopol/26365,https://censor.net/en/photonews/3502610/obstril_nikopolya_1_serpnya_ye_jertvy","Type of area affected=Residential,Weapon System=Unknown"
"6HO2FP","08/01/2024","50.420127","36.977203","Rzhevka, Belgorod oblast","An agricultural enterprise on fire after a reported shelling.","https://t.me/huyovy_kharkiv/155201,https://t.me/Donbas_Operativnyi/85234","Type of area affected=Food/Food Infrastructure"
"M19WQS","08/01/2024","47.554936","34.403631","Nikopol, Dnipropetrovsk region","Two people killed, one injured in a shelling of what appears to be a residential area. ","https://t.me/dnipropetrovskaODA/14992,https://t.me/mvs_ukraine/40371,https://t.me/pgo_gov_ua/25274","Type of area affected=Residential,Type of area affected=School or childcare,Type of area affected=Roads/Highways/Transport,Type of area affected=Humanitarian"
"W49038","08/01/2024","46.651811","32.644077","Kherson","Damaged caused to a residential area that was struck previously.","https://t.me/kherson_non_fake/16392","Type of area affected=Residential"
"KILFQI","08/02/2024","47.55461","34.38984","Nikopol","Church destroyed by shelling. ","https://t.me/other_nikopol/26392,https://patriarchia.org.ua/news/rosijski-obstrily-zrujnuvaly-hram-pczu-v-nikopoli-zaklyk-pro-dopomogu/,https://religionpravda.com.ua/?p=61121","Type of area affected=Religious,Type of area affected=Cultural,Weapon System=Unknown"
"M81ACS","08/03/2024","48.278841","37.177378","Pokrovsk, Donetsk region ","A building damaged after a reported strike. ","https://t.me/Donbas_pokrovsk/26924,https://t.me/selidovo_pokrovsk/313167,https://pokrovsk.news/news/view/podhodit-k-zaversheniyu-remont-tretego-korpusa-donntu","Type of area affected=School or childcare,Weapon System=Unknown"
"RIDNGR","08/03/2024","47.983897","37.67179","Donetsk","A petrol station damaged after a reported strike. ","https://t.me/XU_kraine/60596","Type of area affected=Roads/Highways/Transport"
"0SBNYU","08/08/2024","48.150716","37.30521","Selydove, Donetsk region","Multi-story residential buildings damaged, two people reported killed and several injured in an alleged KAB missile hit.","https://t.me/Donbas_Operativnyi/85808,https://t.me/Donbas_Operativnyi/85809,https://t.me/Donbas_Operativnyi/85821,https://t.me/Donbas_Operativnyi/85827,https://t.me/Donbas_Operativnyi/85839,https://t.me/Donbas_Operativnyi/85840,https://t.me/DonetskaODA/18660,https://t.me/DonetskaODA/18664,https://t.me/yaaa_s_Donbassa/41789,https://t.me/Donetsk_obl_prokuratura/2908,https://t.me/mvs_ukraine/40563","Type of area affected=Residential,Type of area affected=Administrative,Type of area affected=Roads/Highways/Transport,Weapon System=Air strike"
"I1R7A2","08/08/2024","48.395189","37.852872","Toretsk, Donetsk region","A supermarket appears to be on fire after a shelling.","https://t.me/Donbas_Operativnyi/85836","Type of area affected=Commercial"
"VMR9OI","08/08/2024","48.509104","37.674724","Kostyantynivka, Donetsk region","More than ten people killed and several dozens injured in a reported missile attack on a supermarket.","https://t.me/sumygo/80088,https://t.me/Donbas_Operativnyi/85783,https://t.me/DonetskaODA/18634,https://t.me/DonetskaODA/18675,https://t.me/DonetskaODA/18678,https://t.me/DonetskaODA/18689,https://t.me/DonetskaODA/18692,https://t.me/DonetskaODA/18693,https://t.me/DonetskaODA/18699,https://t.me/DonetskaODA/18700,https://t.me/mvs_ukraine/40567,https://t.me/mvs_ukraine/40568,https://t.me/mvs_ukraine/40577,https://t.me/mvs_ukraine/40582","Type of area affected=Commercial"
"04HIXB","08/08/2024","51.037509","35.103358","Mohrytsya, Sumy region","Two people, including a child, killed at the local school in a reported KAB attack.","https://t.me/news_sumy24/48439,https://t.me/Sumy_news_ODA/28824,https://su.isuo.org/schools/view/id/14765","Type of area affected=School or childcare"
"RP1SKJ","08/08/2024","51.012225","34.778921","Stetskivka, Sumy region","School building destroyed by strike. ","https://t.me/news_sumy24/48304,https://t.me/news_sumy24/48314,https://t.me/news_sumy24/48317,https://t.me/news_sumy24/48336,https://t.me/news_sumy24/48352,https://t.me/sumygo/79948","Type of area affected=School or childcare"
"4YGI4Q","08/08/2024","49.721391","37.607433","Kupyansk, Kharkiv region","Three people reportedly injured in a shelling of residential areas.","https://t.me/mvs_ukraine/40552,https://vk.com/wall-30303994_54915,https://vk.com/wall-30303994_54915,https://vk.com/wall-30303994_54915,https://vk.com/wall-30303994_54915","Type of area affected=Residential,Type of area affected=Commercial"
"XANXHG","08/09/2024","46.673435","32.679662","Oncology Hospital area / Kherson","Civilian vehicle hit by drone strike. ","https://t.me/kherson_non_fake/16572,https://t.me/kherson_non_fake/16576","Type of area affected=Roads/Highways/Transport,Weapon System=Loitering munition"
"VWMFCS","08/09/2024","50.384444","36.882222","Shebekino, Belgorod region","Commercial building struck by UAVs. ","https://t.me/itsdonetsk/184330,https://t.me/itsdonetsk/184352,https://t.me/itsdonetsk/184374","Type of area affected=Commercial,Type of area affected=Residential,Weapon System=Loitering munition"
"B0S8E8","08/09/2024","48.50906","37.674767","Kostyantynivka, Donetsk","Reports of 14 dead, 43 wounded, including at least two children, after strike on hypermarket. ","https://t.me/huyovy_kharkiv/155970,https://t.me/huyovy_kharkiv/155980,https://t.me/huyovy_kharkiv/155998,https://t.me/huyovy_kharkiv/156060","Type of area affected=Commercial,Weapon System=Unknown"
"UA189Q","08/10/2024","50.328293","36.188137","Kozacha Lopan","Railway and energy infrastructure reportedly destroyed by strike","https://t.me/huyovy_kharkiv/156153","Type of area affected=Roads/Highways/Transport,Weapon System=Unknown"
"2FPCST","08/11/2024","50.274499","35.979224","Zolochiv (Kharkiv oblast)","House of the Childrens and Youths Creativity hit by strike. ","https://t.me/huyovy_kharkiv/156146","Type of area affected=Cultural,Weapon System=Unknown"
"LSOF2I","08/13/2024","46.636159","32.617944","Kherson","A university building damaged after a reported strike. ","https://t.me/suspilnekherson/47897,https://novakahovka.city/articles/375365/pid-obstrili-okupantiv-potrapiv-istorichnij-korpus-hersonskogo-derzhavnogo-universitetu","Type of area affected=School or childcare,Type of area affected=Religious,Type of area affected=Cultural,Weapon System=Unknown"
"NCU7GY","08/13/2024","50.941576","34.758756","Sumy","A hospital damaged after a reported strike. ","https://t.me/news_sumy24/49269,https://trybuna.sumy.ua/news/kardioczentr-u-sumah-zaznav-poshkodzhen-cherez-rosijskyj-udar/,https://t.me/news_sumy24/49239","Type of area affected=Healthcare,Weapon System=Unknown"
"HP8CAZ","08/13/2024","48.86369","38.478652","Lysychansk, Luhansk region","Two people reportedly killed and more injured after a reported strike on a bus. ","https://t.me/XU_kraine/61229,https://t.me/XU_kraine/61235,https://x.com/LeoonfrankFrank/status/1823392758989807937","Type of area affected=Roads/Highways/Transport,Weapon System=Unknown"
"58L0LQ","08/14/2024","48.290174","37.224436","Mirnohrad, Donetsk Oblast","A building on fire after reported strike.","https://t.me/yaaa_s_Donbassa/41946","Type of area affected=Food/Food Infrastructure,Weapon System=Unknown"
"16BFXX","08/14/2024","51.283244","34.285185","Tyetkino, Kursk","Allegedly destroyed post office.","https://t.me/hercon_ru/18278","Type of area affected=Administrative,Weapon System=Unknown"
"NMC9U7","08/15/2024","50.158316","37.332528","Prykolotne, Kharkiv region","Destroyed school after the reported strike.","https://t.me/kharkivlife/92137","Type of area affected=School or childcare,Weapon System=Unknown"
"RL19RB","08/15/2024","51.625933","35.27908","Lgov, Kursk oblast","A crater of impact visible near what is reported to be a swimming pool.","https://t.me/Bratchuk_Sergey/95023,https://t.me/Donbas_Operativnyi/86515,https://x.com/UA__oleg/status/1824055351466955235","Type of area affected=School or childcare,Weapon System=Unknown"
"F51ZS0","08/15/2024","49.650194","37.64652","Kupyansk-Vuzlovyi, Kharkiv region","A nine-story residential building hit in a shelling, reportedly killing two and injuring four people.","https://t.me/kharkivlife/92094","Type of area affected=Residential,Type of area affected=Roads/Highways/Transport"
"B09DOS","08/15/2024","50.16289","37.350111","Prykolotne, Kharkiv region","A building of an enterprise hit killing two and injuring five people.","https://t.me/kharkivlife/92137,https://t.me/prokuratura_kharkiv/18081","Type of area affected=Commercial"
"KVIR45","08/15/2024","47.945941","37.599617","Donetsk","A shopping mall on fire after a reported strike.","https://t.me/yaaa_s_Donbassa/41993,https://x.com/loogunda/status/1824512908581318860","Type of area affected=Commercial"
"2VN6WS","08/15/2024","48.497187","35.949213","Pavlohrad, Dnipropetrovsk region","Aftermath of a reported bombing of a city.","https://t.me/Donbas_Operativnyi/86490,https://x.com/Zlatti_71/status/1824043092153958549/video/1","Type of area affected=Undefined,Type of area affected=Industrial"
"H31XJZ","08/16/2024","46.677001","32.739505","Antonivka, Kherson region","A school damaged after a reported strike. ","https://t.me/other_nikopol/27272","Type of area affected=School or childcare"
"G43OJ3","08/16/2024","46.676976","32.739592","Antonovka, Kherson","Drone strike caused a fire in a school. First responders reportedly also attacked by a drone. ","https://t.me/kherson_non_fake/16653,https://x.com/OlenaHalushka/status/1825559534753980706","Type of area affected=School or childcare,Weapon System=Loitering munition"
"1LQSL5","08/17/2024","50.896828","34.808717","Sumy","Two people injured after a strike caused a fire in Sumy. ","https://t.me/XU_kraine/61484,https://t.me/itsdonetsk/186536,https://t.me/huyovy_kharkiv/156663,https://t.me/XU_kraine/61487","Type of area affected=Roads/Highways/Transport,Weapon System=Unknown"
"6CTI3Y","08/17/2024","48.280817","37.268951","Myrnohrad, Donetsk region","One person reportedly killed and four others injured after a strike destroyed a multi storey building. ","https://t.me/XU_kraine/61527,https://t.me/XU_kraine/61556,https://t.me/VadymFilashkin/3803,https://liveuamap.com/en/2024/18-august-consequences-of-yesterdays-shelling-of-mirnograd","Type of area affected=Residential,Weapon System=Unknown"
"B9L9YM","08/17/2024","47.508345","34.592986","Enerhodar, Zaporizhzhia region","Impact crater on the road after a reported strike in the vicinity of the nuclear power plant.","https://t.me/itsdonetsk/186616","Type of area affected=Industrial"
"K82JOZ","08/17/2024","50.896414","34.809326","Sumy","Several wounded and extensive damaged to residential area after strike.","https://t.me/news_sumy24/49778,https://t.me/news_sumy24/49782,https://t.me/news_sumy24/49786,https://t.me/news_sumy24/49787,https://t.me/news_sumy24/49788,https://t.me/news_sumy24/49792,https://english.nv.ua/nation/russian-missile-attack-in-sumy-damages-cars-buildings-two-wounded-50443720.html","Type of area affected=Residential,Weapon System=Unknown"
"YQCY7T","08/18/2024","48.353566","38.042398","Horlivka, Donetsk region","Four workers of the emergency services reportedly injured while extinguishing fire from another strike. ","https://t.me/XU_kraine/61552,https://t.me/XU_kraine/61559","Type of area affected=Roads/Highways/Transport"
"CUDN02","08/18/2024","47.944529","37.608149","Donetsk","Church damaged after a reported strike on the city centre.","https://t.me/XU_kraine/61564,https://t.me/XU_kraine/61570","Type of area affected=Religious"
"S5G0VP","08/18/2024","46.693983","41.780217","Proletarsk, Rostov region","An oil depot on fire after a reported strike. ","https://t.me/itsdonetsk/186826","Type of area affected=Industrial"
"7141U8","08/20/2024","48.26737","37.290798","Myrnohrad, Donetsk region","A building of a mine damaged after a reported strike.","https://t.me/XU_kraine/61699","Type of area affected=Industrial"
"FS0CO1","08/20/2024","49.571243","25.594322","Ternopil","An industrial facility on fire after a reported attack. ","https://t.me/suspilnenews/37067,https://www.youtube.com/watch?v=ezepXqOD7CE&t=12s,https://rudana.com.ua/news/pid-chas-nichnoyi-ataky-rf-udaryla-po-promyslovomu-obyektu-v-ternopoli-palaye-masshtabna,https://www.tiktok.com/@faine_misto/video/7405123836871560453,https://www.facebook.com/DSNSTERNOPIL/posts/pfbid0yxvn3bhqPn6CUwAgsmHnaRE9uSJhEGuPNTyjeLPXshvGw2g9pDfCg8VZasBFqDy8l,https://www.facebook.com/DSNSTERNOPIL/posts/pfbid0m1fujStB8uxWJHcoGhkowsk6QN2JFf8wHGvKWyq95zvF13PrEaBDtQinx3ucgzJcl","Type of area affected=Industrial,Weapon System=Loitering munition"
"WEYX28","08/20/2024","48.326967","37.308905","Myrnohrad, Donetsk region ","A mine damaged after a reported strike. ","https://t.me/XU_kraine/61699","Type of area affected=Industrial"
"ZPVDDL","08/20/2024","47.655203","35.257383","Malokaterynivka, Zaporizhia region ","A child killed, and more children injured after a reported strike on a children's cafe. [graphic]","https://t.me/XU_kraine/61690,https://t.me/suspilnenews/37091,https://t.me/suspilnenews/37097,https://t.me/other_nikopol/27420,https://censor.net/news/3505727/cherez_obstrily_rf_v_zaporizkiyi_oblasti_poraneno_3_diteyi","Type of area affected=School or childcare,Type of area affected=Commercial"
"4I8DJJ","08/21/2024","46.67573","32.702189","Antonivka, Kherson region","A church reportedly destroyed in a shelling, one person killed.","https://t.me/hueviyherson/61057","Type of area affected=Religious"
"QRH6PK","08/21/2024","48.513032","37.682616","Kostyantynivka, Donetsk region","Damaged residential building after the reported strike.","https://t.me/donbass24_7/50032?single,https://unn.ua/en/news/occupants-shelled-kostyantynivka-with-artillery-a-man-was-killed-there-are-destructions","Type of area affected=Administrative,Type of area affected=Undefined,Weapon System=Unknown"
