"id","date","latitude","longitude","location","description","sources","associations"
"CIV0098","02/24/2022","49.212119","38.905921","","Individual injured by shelling, ambulance responds.","https://www.facebook.com/story.php?story_fbid=317408247086919&id=100064532388988","Type of area affected=Residential,Weapon System=Unknown"
"CIV0013","02/24/2022","48.055395","37.7783","","Apparent strike on hospital in separatist held area.","https://twitter.com/City_Donetsk/status/1496877801689038859","Type of area affected=Healthcare,Weapon System=Unknown"
"CIV0004","02/24/2022","47.775609","37.239673","","Explosion in central Kyiv, nothing further yet.","https://twitter.com/N_Waters89/status/1496856695896969222,https://twitter.com/IBN_MOHAMMAD/status/1496778855863963650,https://twitter.com/amnestypress/status/1496872501447700481,https://twitter.com/TiranaHassan/status/1497348792038924290,https://www.hrw.org/news/2022/02/25/ukraine-russian-cluster-munition-hits-hospital","Type of area affected=Healthcare,Weapon System=Cluster munitions"
"CIV0011","02/24/2022","50.30831","34.880702","","Civilian buildings damaged and destroyed by shelling. ","https://t.me/nexta_live/16696","Type of area affected=Commercial,Weapon System=Unknown"
"CIV0008","02/24/2022","47.117099","37.684831","","civilian homes hit by artillery. ","https://t.me/mariupolrada/8465,https://twitter.com/IntelCrab/status/1496840102651256832","Type of area affected=Residential,Weapon System=Unknown"
"CIV0007","02/24/2022","46.227914","34.642854","","[Graphic: Image shows a dead child wrapped in a blanket] Child killed by explosion.","https://t.me/Pravda_Gerashchenko/190,https://twitter.com/GayanaYuksel/status/1496831609902968840","Weapon System=Unknown"
"CIV0002","02/24/2022","48.748938","30.218889","","Civilians hit by what appears to have been artillery, possibly a rocket. Appears to have been at least one fatality, possibly a child. ","https://twitter.com/realistqx1/status/1496757503195029508,https://twitter.com/ragipsoylu/status/1496737243255480321,https://twitter.com/Liveuamap/status/1496739229040537603,https://twitter.com/AFP/status/1496768532448788482","Type of area affected=Commercial,Weapon System=Air strike"
"CIV0001","02/24/2022","49.850781","36.659762","","Apartment block hit. Crater is very large, possibly cruise or ballistic missile as part of attack on nearby airport. Appear to have been multiple civilian casualties, AA Agency reporting 1 x fatality 12 x wounded.","https://twitter.com/PDocumentarians/status/1496731018723835907,https://twitter.com/JimmySecUK/status/1496754882002534400,https://twitter.com/AFP/status/1496778152387178508,https://twitter.com/AlexanderLouri4/status/1496761690561683456,https://twitter.com/Michael1Sheldon/status/1496717647089651716,https://twitter.com/AlexanderLouri4/status/1496783483745755141,https://twitter.com/AlexanderLouri4/status/1496762766316687363,https://twitter.com/666_mancer/status/1496868095842865154,https://twitter.com/AlexanderLouri4/status/1496765032167710723,https://twitter.com/anadoluagency/status/1496768205314007040","Type of area affected=Residential,Weapon System=Unknown"
"CIV0010","02/24/2022","48.051489","37.778075","","Artillery fire on what appears to be an urban area.","https://twitter.com/Caucasuswar/status/1496846910912610309","Type of area affected=Healthcare,Weapon System=Unknown"
"CIV0005","02/24/2022","47.379841","37.756229","Novoselivka Druha","Civilian homes hit by artillery.","https://www.facebook.com/vladimir.veselkin/posts/4879589275493852?__cft__[0]=AZXA_3UfzprG0miGLoWQnskeHb73AKh7lPhzX_HGf-cLpIwl3cpOlBTWaB_4DUIIXOpSF7IsZJbPsT_r3dfPH1sFLM7n1Zg-XcAEtvPQ6bkNud09ukdcOLGFNGMy1-f_iFg&__tn__=%2CO%2CP-R,https://web.archive.org/web/20220224112540/https://twitter.com/vital_ovchar/status/1496808502802759683,https://t.me/pavlokyrylenko_amcu/2401","Type of area affected=Residential,Weapon System=Unknown"
"CIV0009","02/24/2022","47.120906","37.68099","","A civilian casualty from an explosion. ","https://t.me/mariupol/3081,https://t.me/mariupol/3007","Type of area affected=Residential,Weapon System=Unknown"
"CIV0003","02/24/2022","50.470772","30.528098","","Explosion in central Kyiv, nothing further yet.","https://twitter.com/TreyYingst/status/1496793744590389249,https://twitter.com/FannyFacsar/status/1496787968203231232,https://twitter.com/AuroraIntel/status/1496791736504528897,https://twitter.com/olgatokariuk/status/1496794328806612993",""
"D8AJIN","02/25/2022","49.263598","38.905748","Starobilsk, Luhansk

","Damage to a shop.","https://www.facebook.com/photo/?fbid=131617916044267&set=pcb.131589862713739","Type of area affected=Commercial"
"CIV1921","02/25/2022","50.072133","36.142258","Kharkiv","Aftermath of a strike on Kharkiv Veterinary University. Multiple smaller craters indicate this was a cluster munition.  ","https://www.facebook.com/100007162663296/videos/409947017565995,https://www.facebook.com/loudmilka/posts/pfbid0EzSMtdWPkXzKwx6Bu6oHGdBi21cCuo2RgazHpBTF65jizztbDXfGFib6rWSYievel?__cft__[0]=AZUfUk8BQifgXV5QTeMjIPK-LEGxJk0V_EglCxpys8C9WHczMJOWEACtqZFmg-yMBqfvdxVzOvs8eVzVDLBEhPy8rIi04pSZaZemAu-2cQmQ2Q&__tn__=%2CO%2CP-R","Type of area affected=School or childcare,Weapon System=Cluster munitions"
"CIV1577","02/25/2022","50.55544","30.274574","","Shooting of civilian cars near Hostomel.","HIDDEN","Type of area affected=Roads/Highways/Transport,Weapon System=Small arms,Weapon System=Vehicle mounted weapon"
"CIV1466","02/25/2022","50.554625","30.274866","","Civilian vehicles come under small arms fire.","https://suspilne.media/amp/286363-rozstrilali-10-evakuacijnih-avto-sbu-vstanovila-osobi-patoh-vijskovih-rf/,https://t.me/suspilnenews/14513,https://t.me/uniannet/73863,https://t.me/minjustofficial/2663","Weapon System=Small arms"
"CIV0460","02/25/2022","50.022621","36.330786","","Rocket motor impacted grove of trees next to children's playground. ","https://twitter.com/2022Kharkiv/status/1498034291577610250","Type of area affected=Residential,Weapon System=Cluster munitions"
"CIV0378","02/25/2022","48.325376","38.13745","","[very graphic: badly wounded bodies] Two people killed in strike on school.","https://twitter.com/PLnewstoday/status/1497188820739104773/photo/3,https://t.me/nm_dnr/6409,https://www.youtube.com/watch?v=OIW-IacnviQ","Type of area affected=School or childcare,Weapon System=Unknown"
"CIV0162","02/25/2022","48.335133","38.083468","","Reportedly, one civilian was killed and 6 injured in an artillery strike in Gorlovka, DPR","https://t.me/nm_dnr/6395","Type of area affected=Residential,Weapon System=HE rocket artillery"
"CIV0163","02/25/2022","46.757458","33.370035","","Multiple Launch Rocket System firing.","https://twitter.com/GraniTweet/status/1497149587215298571","Weapon System=HE rocket artillery"
"CIV0094","02/25/2022","49.271145","38.908924","","Civilian areas shelled, many residential buildings destroyed.","https://www.facebook.com/groups/820419854981203/posts/1571696369853544/,https://www.facebook.com/100075881777013/posts/131589862713739/,https://www.facebook.com/watch/?v=923732664951321&extid=CL-UNK-UNK-UNK-AN_GK0T-GK1C&ref=sharing",""
"CIV0038","02/25/2022","47.640511","37.549282","","[Graphic: Video shows charred human remains] At least one person killed by explosion, allegedly from artillery strike.","https://twitter.com/Shrik_E/status/1497275830094942209","Type of area affected=Commercial,Weapon System=Unknown"
"CIV0040","02/25/2022","50.101871","36.280335","","Zoo damaged by explosions.","https://t.me/hueviykharkov/46384","Type of area affected=Commercial,Weapon System=Unknown"
"CIV0027","02/25/2022","50.043851","36.355906","","Residential building showing signs of explosive damage.","https://t.me/nexta_live/17220","Type of area affected=Residential,Weapon System=Unknown"
"CIV0033","02/25/2022","50.554436","30.275219","","[Graphic: Video shows bloodied man receiving medical care] At least one civilian injured as vehicles come under small arms fire.","HIDDEN","Type of area affected=Commercial,Weapon System=Small arms"
"CIV0034","02/25/2022","50.515101","30.227361","","Residential building and civilian vehicles damaged by missile/artillery strike.","HIDDEN","Type of area affected=Residential,Weapon System=Unknown"
"CIV0036","02/25/2022","50.048422","36.189287","","Multiple Launch Rocket System barrage in the middle of an intersection in a residential/business area.","https://twitter.com/Archer83Able/status/1497266803214532609","Type of area affected=Commercial,Weapon System=HE rocket artillery"
"CIV0030","02/25/2022","47.595307","37.498954","Volnovakha, Donetsk Oblast"," [Graphic: Video shows dead woman lying on the street] At least one civilian killed; damage to residential building, possibly from artillery/missile strikes.","https://twitter.com/Shrik_E/status/1497253753476599814,https://twitter.com/poppoppopkt/status/1497205249362247694,https://twitter.com/MarQs__/status/1497257979883581442","Type of area affected=Residential,Weapon System=Unknown"
"CIV0032","02/25/2022","46.840001","35.371448","","Hospital and adjacent building come under small arms fire.","https://twitter.com/nexta_tv/status/1497240135615791107","Type of area affected=Healthcare,Weapon System=Small arms"
"CIV0024","02/25/2022","50.309797","34.869819","","[Graphic: Image shows at least one dead person lying by a pool of blood] Kindergarten hit by cluster munition.","https://drive.google.com/file/d/15BxYoZN0vMZbnGJA4WipINhXZBC_UOLz/view?usp=sharing,https://twitter.com/no_itsmyturn/status/1497184730395074562,https://twitter.com/KyivIndependent/status/1497184726595125250,https://twitter.com/MitchvdKlundert/status/1497201512547860483,https://twitter.com/3TrAmvL026aJRar/status/1497195337089490945","Type of area affected=School or childcare,Weapon System=Cluster munitions"
"CIV0026","02/25/2022","50.48578","30.472572","","[Graphic: Video shows three dead, bloodied people laying on the street] At least three civilians killed while driving in a vehicle on Krillovskaya Street, Kyiv. Civilians were allegedly mistaken for Russian infiltrators.","HIDDEN","Weapon System=Unknown"
"CIV0028","02/25/2022","46.63902","32.610597","","Video of burned-out building. Accompanying text indicates it was the central market.","https://twitter.com/poppoppopkt/status/1497140485013467137,https://t.me/nexta_live/17239","Type of area affected=Commercial,Weapon System=Unknown"
"CIV0029","02/25/2022","46.609299","32.844455","","Civilian vehicle comes under fire while driving down a highway.","HIDDEN","Weapon System=Small arms"
"CIV0035","02/25/2022","50.003909","36.257006","","Residential building damaged by rocket motor.","https://twitter.com/bbcrussian/status/1497264217317154816","Type of area affected=Residential,Weapon System=Cluster munitions"
"CIV0031","02/25/2022","50.016079","36.278015","","Artillery (Multiple Launch Rocket System) strike on a residential area.","HIDDEN","Type of area affected=Residential,Type of area affected=Military,Weapon System=HE rocket artillery,Weapon System=Cluster munitions"
"CIV0023","02/25/2022","50.047178","36.354722","","Russian or Ukrainian speaking men in a vehicle come under fire as they approach a roadblock.","https://t.me/Caucasian_bureau/31685","Weapon System=Small arms"
"CIV0021","02/25/2022","50.546331","30.205834","","Rocket motor embedded in pavement in residential area. ","https://www.facebook.com/pantera.kira/posts/1957953117745193,https://twitter.com/UAWeapons/status/1497176385420464133,https://drive.google.com/file/d/17XDaloleq4WRnUwtD634az-UiLRbf_0n/view?usp=sharing,https://twitter.com/3TrAmvL026aJRar/status/1497161918586499109","Type of area affected=Residential,Weapon System=Cruise missile"
"CIV0015","02/25/2022","50.405361","30.645226","","Apartment building on fire; three people reported injured","https://twitter.com/HannaLiubakova/status/1497057602794049537,https://twitter.com/ChristopherJM/status/1497048113504301090,https://t.me/nexta_live/17090,https://twitter.com/ItsBorys/status/1497182733071753230,https://twitter.com/terrelljstarr/status/1497134872992833551,https://twitter.com/jimmysecuk/status/1497130333556334595","Type of area affected=Residential,Weapon System=Unknown"
"CIV0019","02/25/2022","49.990865","36.267825","","Another weapon remnant (also possibly from a BM-30 rocket) in another area of Kharkiv","https://t.me/vorposte/13723","Type of area affected=Residential,Weapon System=Cluster munitions"
"CIV0022","02/25/2022","50.447941","30.4762","","Smoke rising from a residential building on Victory Avenue; accompanying text suggests smoke is the result of firefight in the area.","https://t.me/nexta_live/17178","Type of area affected=Residential,Weapon System=Small arms"
"CIV0018","02/25/2022","49.987287","36.261269","","Rocket motor lodged in a street at zebra crossing.","https://t.me/vorposte/13720,https://t.me/nexta_live/17149,https://t.me/KharkivTODAY1/3065","Type of area affected=Residential,Weapon System=Cluster munitions"
"CIV0014","02/25/2022","49.271134","38.90893","Starobilsk, Luhansk","Damage to residential area; one civilian reported dead. Image appears to show damage to a school.","https://t.me/nexta_live/17109,https://twitter.com/KyivIndependent/status/1497082148460843036,https://twitter.com/dimadifol/status/1497347380429180930,https://www.facebook.com/sergey.gaidai.loga/posts/131589862713739,https://t.me/dsns_telegram/3906,https://pikabu.ru/story/starobelsk_kvartal_100yiy_8870027,https://www.facebook.com/svatoveDSNS/posts/pfbid0XJYABipmc6kfXmSSLMcAMs29zCbK8NSzK9idKktHHtRXHq86ey9Wue6EuqgfvB8sl","Type of area affected=School or childcare,Weapon System=Unknown"
"CIV0016","02/25/2022","50.594515","30.217552","Hostomel","Damage to an apartment building.","HIDDEN","Type of area affected=Residential,Weapon System=Unknown"
"CIV0017","02/25/2022","50.517653","30.490035","","Military vehicle runs over a civilian vehicle; at least one civilian inside appears to have survived. Unclear which country the military vehicle belongs to.","HIDDEN","Weapon System=Vehicle mounted weapon"
"CIV0380","02/26/2022","47.977124","37.697989","","Tochka missile rocket motor landed immediately next to oil depot. ","https://t.me/nm_dnr/6472,https://t.me/nm_dnr/6446,https://t.me/DNR_SCKK/6240","Type of area affected=Industrial,Weapon System=Ballistic missile"
"CIV0192","02/26/2022","47.97764","37.698898","","Remnants of a missile at an oil depot","https://twitter.com/DNR_online_/status/1497495576618934272","Type of area affected=Industrial,Weapon System=Ballistic missile"
"CIV0174","02/26/2022","50.184706","36.119724","","Abandoned armoured vehicles and a person's body","https://t.me/truexanewsua/27293,https://t.me/truexanewsua/24341","Weapon System=Small arms"
"CIV0112","02/26/2022","50.541125","30.174271","","Residential building hit by strike.","https://www.instagram.com/tv/Cab70RxFXMU/?utm_source=ig_web_copy_link",""
"CIV0109","02/26/2022","50.020087","36.348275","","Missile exploded on the sidewalk. Reportedly one pedestrian died.","HIDDEN","Type of area affected=Residential,Weapon System=Unknown"
"CIV0100","02/26/2022","48.915311","38.429935","","Residential buildings destroyed by shelling.","https://www.facebook.com/story.php?story_fbid=1388217971693967&id=102113453637765","Type of area affected=Residential,Weapon System=Unknown"
"CIV0054","02/26/2022","50.026301","36.364475","","Residential building damaged by explosion.","https://www.pravda.com.ua/rus/news/2022/02/26/7326302/,https://t.me/nexta_live/17951,https://www.facebook.com/irina.venediktova.31/posts/5257883167557909","Type of area affected=Residential,Weapon System=Unknown"
"CIV0053","02/26/2022","50.451214","30.481072","","Children's hospital hit by artillery.","https://twitter.com/rezarvhimi/status/1497679376795815946,https://twitter.com/YFloropoulos/status/1497691751858982912,https://twitter.com/olex_scherba/status/1497666436596043776","Type of area affected=Healthcare,Weapon System=HE rocket artillery"
"CIV0055","02/26/2022","49.591001","36.992622","","Bus came under fire, multiple civilian fatalities.","https://www.facebook.com/pavlokyrylenko.donoda/posts/pfbid02BLbExaL4hDU2hsqfXwrd2PEwRGY13LCQGjxYvGv5j81H6hSgim6q1KXjVJmoXacJl?__xts__[0]=68.ARB4kV93sTKgzlCYyDGSdWFOhIrMb6H_XNoiigE0MtIXTXKi25pj9rlIs4bhSlkT8UuusW1wmDCfOvL3-VatH80EqaFgJhLDuNJwvHlfBac-ItQ7N9crLE_t_-RKy8ESChPMH8codg0qSf6N8wmrd_or4b485J7IixxadhLgtrpLCg4hfz3OtHAZ5sSlutx9_-oLzZNF7E3d6a_7qG92RTqv_CtEtx3xxg08RWPigH3Lk08zNpSHcj-Qo0RVWTpjgz5i57kcK8JbHy9_m_PaVsms8REooo67WMWyPOqOsXbM-aU,https://twitter.com/KyivIndependent/status/1497616576580780034","Weapon System=Small arms"
"CIV0043","02/26/2022","47.179974","37.697955","","[Graphic: Video shows a dead body lying on the road] Explosions damage residential neighbourhood and kill at least one person.","HIDDEN","Type of area affected=Residential,Weapon System=HE rocket artillery"
"CIV0045","02/26/2022","46.743368","32.716182","","Attack on marked civilian ambulance, claimed 2 civilian fatalities and one civilian injury.","HIDDEN","Type of area affected=Healthcare,Weapon System=Unknown"
"CIV0042","02/26/2022","51.524621","31.325789","","Apartment building on fire; three people reported injured.","https://t.me/nexta_live/17717,https://t.me/nexta_live/17711","Type of area affected=Residential,Weapon System=Unknown"
"CIV0046","02/26/2022","47.180494","37.697469","Donetsk","[Graphic: Two images showing close-up shots of two dead bodies] At least two people killed by explosions in a residential area.","https://twitter.com/Ukrainianfree66/status/1497691796847177728,https://twitter.com/MarQs__/status/1497574553677176834","Type of area affected=Residential,Weapon System=Unknown"
"CIV0048","02/26/2022","50.659118","29.966315","","Ukrainian State Emergency Service reports that a shell impacted the village of Borodyanka near Kyiv, killing at least three people.","https://twitter.com/24UkraineNews/status/1497556546334699526,https://twitter.com/michaelh992/status/1497561328092864515,https://twitter.com/TRTRussian/status/1497565167793618944,https://twitter.com/hiko_cat_/status/1497559906467078144","Type of area affected=Residential,Weapon System=Unknown"
"CIV0041","02/26/2022","50.42243","30.46507","","Residential building hit by missile.","https://twitter.com/brenna__smith/status/1497464178528903171,https://twitter.com/nexta_tv/status/1497459977350492171,https://twitter.com/christogrozev/status/1497459660357574660,https://twitter.com/BNONews/status/1497479518684073984,https://t.me/hueviykharkov/46417,https://t.me/nexta_live/17610,https://t.me/Pravda_Gerashchenko/392,https://t.me/hueviykharkov/46417,https://t.me/Pravda_Gerashchenko/404","Type of area affected=Residential,Weapon System=Unknown"
"CIV0457","02/27/2022","50.005388","36.353347","Kharkiv (Saltivka district)","Cargo warhead impacted into pavement. Red plastic bag placed over warhead.","https://twitter.com/2022Kharkiv/status/1497955083736150017","Type of area affected=Residential,Weapon System=Cluster munitions"
"CIV0454","02/27/2022","49.998934","36.34908","Kharkiv (Saltivka district)","Rocket motor impacted in asphalt pathway, near a kindergarten.","https://twitter.com/2022Kharkiv/status/1497910214770655232","Type of area affected=Residential,Weapon System=Cluster munitions"
"CIV0448","02/27/2022","50.040035","36.361671","","Rocket motor impacted next to children's playground with Thomas the Tank engine frame.","https://twitter.com/2022Kharkiv/status/1498313925498130436,https://t.me/truexanewsua/24976","Type of area affected=Residential,Weapon System=Cluster munitions"
"CIV0450","02/27/2022","50.025299","36.343886","","Rocket motor impacted in dirt path.","https://twitter.com/2022Kharkiv/status/1497907864723247106","Type of area affected=Residential,Weapon System=Cluster munitions"
"CIV0381","02/27/2022","48.04446","37.777254","","Residential area damaged by explosions. ","https://t.me/nm_dnr/6480","Type of area affected=Residential,Weapon System=Unknown"
"CIV0382","02/27/2022","48.295011","37.98946","","Bus depot damaged, reportedly by artillery. Impact crater visible.","https://ria.ru/20220227/dnr-1775390554.html,https://t.me/nm_dnr/6486","Type of area affected=Industrial,Weapon System=Unknown"
"CIV0164","02/27/2022","50.457852","30.59225","","Assault on an individual in civilian clothing by armed men on Mykilska Slobidka in Kyiv","HIDDEN","Type of area affected=Residential,Weapon System=Unknown"
"CIV0124","02/27/2022","50.02633","36.36466","","Partially collapsed block of flats in Kharkiv, Saltovka district. At least one individual was reported to be killed.","https://drive.google.com/file/d/1DlK66OSFbWwpagTL78bHbY1_VZPaOSx_/view?usp=sharing,https://t.me/truexanewsua/25182,https://drive.google.com/file/d/1A15q87eFH6K45NouP7VRFFp-5cK4hdm9/view?usp=sharing","Type of area affected=Residential,Weapon System=Unknown"
"CIV0114","02/27/2022","50.188952","30.312061","","Vasylkiv Professional College of the National Aviation University (civil aviation) was heavily damaged, reportedly by a rocket strike.","https://drive.google.com/file/d/1P3TS1hmAr-Lkf_FM7F3OxC-0SxfQSkdI/view?usp=sharing","Type of area affected=School or childcare,Weapon System=Unknown"
"CIV0113","02/27/2022","50.189362","30.310863","","Vasylkiv technical college heavily damaged by a rocket strike.","https://drive.google.com/file/d/1Ui6Vm7ShCFcR69010g64in53Z4UrKFCZ/view?usp=sharing","Type of area affected=School or childcare,Weapon System=Unknown"
"CIV0116","02/27/2022","51.314197","26.096736","","Private house and outbuildings damaged by a reconnaissance drone that was shot down.","https://t.me/c/1348181349/19454,https://drive.google.com/file/d/1m6PlMAA6I8Oh-bIj1EVTw0Up-s1c1G-n/view?usp=sharing","Type of area affected=Residential,Weapon System=Unknown"
"CIV0066","02/27/2022","51.49056","31.29445","","Residential area damaged by what may be ballistic missile. Large crater.","https://twitter.com/Nelson_Serg/status/1497923113593585672","Type of area affected=Residential,Weapon System=Unknown"
"CIV0078","02/27/2022","47.612583","37.487385","","ENT department of hospital hit by what appears to have been artillery.","https://twitter.com/momchil_ivanov1/status/1498238338859425792,https://twitter.com/whicard5/status/1497932713612959751","Type of area affected=Healthcare,Weapon System=Unknown"
"CIV0067","02/27/2022","46.96369","32.027105","","Damage to residential buildings after shelling.","https://twitter.com/shaunwalker7/status/1497868180492017664,https://twitter.com/yashar_huseyn/status/1497844415150366725,https://t.me/uniannet/32894","Type of area affected=Residential,Weapon System=Unknown"
"CIV0080","02/27/2022","50.306553","34.880167","","Widespread damage in what appears to be civilian area.","https://t.me/nexta_live/18459","Type of area affected=Military,Weapon System=Unknown"
"CIV0059","02/27/2022","50.481559","34.968444","","Soldiers wearing red bands on arms looting a supermarket.","https://www.unian.net/war/golodnye-okkupanty-rf-obnesli-produktovyy-magazin-v-sumskoy-oblasti-i-popali-na-video-novosti-vtorzheniya-rossii-na-ukrainu-11720614.html,https://twitter.com/RALee85/status/1497853526881546241","Type of area affected=Commercial,Weapon System=Unknown"
"CIV0065","02/27/2022","51.491142","31.296833","","Shchorsa Cinema in urban area completely destroyed.","https://twitter.com/Nelson_Serg/status/1497971946235088899","Type of area affected=Commercial,Weapon System=Unknown"
"CIV0057","02/27/2022","48.943364","38.501031","","Artillery firing from residential area.","https://web.archive.org/web/20220227072208/https://twitter.com/SputnikATO/status/1497834319569633283,https://twitter.com/SputnikATO/status/1497834319569633283,https://twitter.com/Kirilenko_a/status/1497501122906447873,https://pikabu.ru/story/severodonetsk_122mm_gaubitsyi_d30_vsu_v_zhilyikh_kvartalakh_8871344",""
"CIV0060","02/27/2022","47.251705","34.332519","","Soldiers wearing Russian camouflage, with a white recognition band stealing a safe from a bank.","https://socportal.info/ru/news/v-seti-poyavilos-video-kak-russkie-soldaty-grabyat-otdelenie-banka-na-khersonshchine/,https://twitter.com/ASLuhn/status/1497888600146395136,https://news.obozrevatel.com/economics/economy/nastoyaschie-fashistyi-rossijskie-zahvatchiki-v-forme-ograbili-otdelenie-privatbanka-video.htm","Type of area affected=Commercial,Weapon System=Unknown"
"CIV0063","02/27/2022","50.01061","36.28602","","A reported school on fire.","https://twitter.com/nexta_tv/status/1497943838823960576,https://t.me/truexanewsua/25194,https://t.me/nexta_live/19327","Type of area affected=School or childcare,Weapon System=Unknown"
"CIV1907","02/28/2022","50.015972","36.212624","Kharkiv","Apartment building damaged as a result shelling.","https://web.archive.org/web/20220613231815/https://t.me/hueviykharkov/47046,https://www.newsroom.kh.ua/news/v-harkove-na-klochkovskoy-upali-reaktivnye-snaryady-est-ranenye","Type of area affected=Residential,Weapon System=Unknown"
"CIV1654","02/28/2022","50.005054","36.33219","","Rocket motor for what appears to be a 9M55K embedded in path.","https://t.me/vorposte/14405,https://twitter.com/2022Kharkiv/status/1499115758382723076","Type of area affected=Residential,Weapon System=Cluster munitions"
"CIV1655","02/28/2022","50.012303","36.336947","","Cargo warhead embedded in earth next to block of flats.","https://twitter.com/den_hauzer/status/1498218894716243969","Type of area affected=Residential,Weapon System=Cluster munitions"
"CIV0463","02/28/2022","50.020434","36.217065","","Cargo warhead impacted into road outside what may be a healthcare facility.","https://t.me/truexanewsua/26153","Type of area affected=Residential,Weapon System=Cluster munitions"
"CIV0464","02/28/2022","50.002792","36.329056","","Rocket motor impacted into earth.","https://twitter.com/2022Kharkiv/status/1498321124345716739","Type of area affected=Residential,Weapon System=Cluster munitions"
