"id","date","latitude","longitude","location","description","sources","associations"
"CIV1100","06/21/2022","49.838434","36.687871","","[Graphic: bodies] Destruction of commercial area. Reportedly 5 were killed and 11 wounded. ","https://twitter.com/IuliiaMendel/status/1539345012022026240,https://t.me/truexanewsua/51598","Type of area affected=Commercial,Weapon System=Unknown"
"CIV1095","06/21/2022","48.132651","37.743837","","School No. 6 destroyed in Avdiivka, according to reports, it had been used as a ""humanitarian center"".","https://www.facebook.com/profile.php?id=100003850978624,https://www.facebook.com/pavlokyrylenko.donoda/posts/572042937811598,https://twitter.com/MFA_Ukraine/status/1539285296533102596","Type of area affected=School or childcare,Weapon System=Unknown"
"CIV1096","06/21/2022","49.988859","36.232349","","Damage to buildings in Kharkiv. ","https://twitter.com/b_judah/status/1539259909044412416","Type of area affected=Residential,Weapon System=Unknown"
"CIV1139","06/22/2022","50.267123","35.982212","","Massive damage to several homes, at least two bodies were reportedly pulled from the wreckage.","https://t.me/hueviykharkov/67154","Type of area affected=Residential,Weapon System=Unknown"
"CIV1104","06/22/2022","46.967589","32.084459","","Damage as the result of a shelling near a reported gas station.","https://t.me/suspilnemykolaiv/11647","Type of area affected=Industrial,Weapon System=Unknown"
"CIV1110","06/22/2022","47.835618","39.850842","","Oil refinery heavily damaged by drone modified as a loitering munition. ","https://twitter.com/RALee85/status/1539518017763217409,https://t.me/milinfolive/85566,https://t.me/shot_shot/41061,https://t.me/rian_ru/168220","Type of area affected=Industrial,Weapon System=Cruise missile"
"CIV1105","06/22/2022","46.954176","32.073685","","Damage to an industrial area. ","https://t.me/suspilnemykolaiv/11630","Type of area affected=Industrial,Weapon System=Unknown"
"CIV1141","06/23/2022","46.967904","32.084394","","[Graphic: Video shows at least one dog dying in an explosion] CCTV footage of a gas station as it is struck. ","https://t.me/suspilnemykolaiv/11713","Type of area affected=Industrial,Weapon System=Unknown"
"CIV1140","06/23/2022","51.070352","34.906106","","Small fires visible on the side of the road, possibly phosphorus capsules.","https://t.me/suspilnemykolaiv/11658","Type of area affected=Roads/Highways/Transport"
"CIV1115","06/23/2022","47.003362","31.433756","","[Slightly graphic: one photo blurred, one photo the head of a potential deceased person is visible] Shelling of a residential area. ","https://www.facebook.com/mykprok/posts/pfbid0FjRn7RwuirAjQD4BEkCAAKiyPK7kwm5U1JVeepzQ21miwNMYU3RAtoMrbzWFDfK9l","Type of area affected=Residential,Weapon System=Air strike"
"CIV1111","06/23/2022","48.999671","38.397798","","Site of Golden Agro LLC agricultural facility destroyed in strike. ","https://twitter.com/Cellodidas89/status/1539904717014405120,https://twitter.com/wammezz/status/1539920457570390016","Type of area affected=Industrial,Weapon System=Unknown"
"CIV1127","06/25/2022","51.311468","26.608622","","Explosion in a commercial/industrial area. Reportedly, 4 people were killed and 9 wounded in the explosion.","https://t.me/rivne_1283/5715,https://t.me/rivne_1283/5714,https://t.me/rivne_1283/5711,https://t.me/ukraine_now_eng/27288","Type of area affected=Commercial,Weapon System=Unknown"
"CIV1136","06/25/2022","48.129709","37.737889","","Explosive damage to residential and commercial buildings. ","https://t.me/c/1742924192/9792","Type of area affected=Residential,Weapon System=Unknown"
"CIV1126","06/25/2022","47.077259","37.519174","","Damage to mosque in Mariupol. ","https://t.me/mariupolrada/10036","Type of area affected=Religious,Weapon System=Unknown"
"CIV1125","06/25/2022","48.131709","37.729656","","A reported medical lab was damaged.","https://www.facebook.com/photo/?fbid=574887477527144&set=pcb.574887700860455","Type of area affected=Healthcare,Weapon System=Unknown"
"CIV1154","06/26/2022","48.914193","38.424203","","Police department and residential buildings destroyed by explosions.","https://t.me/yaa_s_Donbassaa/5744","Type of area affected=Administrative,Weapon System=Unknown"
"CIV1155","06/26/2022","48.639145","38.36696","","Residential buildings destroyed by explosions. ","https://t.me/yaa_s_Donbassaa/5804","Type of area affected=Residential,Weapon System=Unknown"
"CIV1134","06/26/2022","50.038465","36.243628","","Large crater in the parking lot of a school.","https://twitter.com/dilnyarahman/status/1541308667097763840,https://twitter.com/TpyxaNews/status/1541337285332975617","Type of area affected=School or childcare,Weapon System=Unknown"
"CIV1124","06/26/2022","48.945688","37.621034","","A school in Toretsk was destroyed.","https://t.me/u_now/54966,https://twitter.com/novostidnua/status/1541001696133914624/photo/4,https://freeradio.com.ua/ru/15-atak-y-3-pohybshykh-hrazhdanskykh-hde-strelialy-zakhvatchyky-v-donetskoi-oblasty-y-kakaia-voennaia-sytuatsyia-v-rehyone/","Type of area affected=School or childcare,Weapon System=Unknown"
"CIV1123","06/26/2022","50.033258","36.201112","","Large crater visible after residential area struck. ","https://suspilne.media/254136-ce-podarunok-vid-putina-veteran-viprobuvac-pro-vibuh-raketi-u-harkovi/","Type of area affected=Residential,Weapon System=Unknown"
"CIV1119","06/26/2022","50.461551","30.487465","","Cruise missile strike impacted residential block and near Kindergarten at 50.464581, 30.484389. Possible target was the HQ of Zavod Artem, an arms manufacturer. At least one child appears to have been injured. ","HIDDEN","Type of area affected=Residential,Weapon System=Cruise missile"
"CIV1122","06/26/2022","49.4751","32.0341","","Explosion in the immediate vicinity of a bridge. ","https://twitter.com/DefMon3/status/1541029819458244609","Type of area affected=Roads/Highways/Transport,Weapon System=Unknown"
"CIV1117","06/26/2022","49.982226","36.365486","","Explosions in Kharkiv.","https://twitter.com/TWMCLtd/status/1540838066503520256","Type of area affected=Residential,Weapon System=Unknown"
"CIV1130","06/27/2022","49.950543","36.307912","","Secondary school struck and destroyed.","https://t.me/hueviykharkov/66838","Type of area affected=School or childcare,Weapon System=Ballistic missile"
"CIV1135","06/27/2022","48.918249","38.411576","","Massive damage to what appear to be residential areas across Lysychanksk. Reportedly, at least 8 people died. ","https://t.me/luhanskaVTSA/3829","Type of area affected=Residential,Weapon System=Unknown"
"CIV1120","06/27/2022","49.069889","33.425336","","Two missiles hit a shopping mall. At least 18 people were killed, and 57 others were injured.","https://twitter.com/TpyxaNews/status/1541432954383220737,https://twitter.com/olliecarroll/status/1541425535141699589,https://twitter.com/visegrad24/status/1541426481435385856,https://www.facebook.com/MNS.GOV.UA/posts/pfbid02YMkjRBCJq8M5pFPk41fYjkfq9bap1yYfJMkU2rcfEBVrLrFF31NoTuvAUhASXimAl,https://twitter.com/AlexKhrebet/status/1541422779551125504,https://twitter.com/olliecarroll/status/1541495461223321610,https://www.facebook.com/ivan.katchanovski/posts/pfbid02vi5XJqu8aeGaRaoBnk8nLfy4BVaukrG9uGPL81kdTnp5NsdYhbqfzCnLRwoPRuDql,https://twitter.com/suspilne_news/status/1541481864933904391,https://pol.gp.gov.ua/ua/news.html?_m=publications&_c=view&_t=rec&id=315372","Type of area affected=Commercial,Weapon System=Cruise missile"
"CIV1156","06/28/2022","48.79254","38.534611","","Residential buildings destroyed by explosions. ","https://t.me/yaa_s_Donbassaa/5837","Type of area affected=Residential,Weapon System=Unknown"
"CIV1147","06/28/2022","46.610822","31.550539","","Strike impacted several locations, including a market. ","https://twitter.com/lyolya_ua/status/1541677606453510144","Type of area affected=Commercial,Weapon System=Unknown"
"CIV1128","06/28/2022","46.971301","31.96066","","Large crater visible in a stadium.","https://t.me/truexanewsua/52245","Type of area affected=Cultural,Weapon System=Unknown"
"CIV1131","06/28/2022","49.92409","36.409732","","Shelling of what appears to be a residential area, much of the footage is blurred.","HIDDEN","Type of area affected=Residential,Weapon System=Unknown"
"CIV1132","06/28/2022","46.752442","36.779393","","Plume of smoke rising from Berdyansk port.","https://t.me/truexanewsua/52307","Type of area affected=Industrial,Weapon System=Unknown"
"CIV1157","06/29/2022","47.941489","37.505089","","Destroyed residential and commercial buildings, as well as a church. ","https://t.me/yaa_s_Donbassaa/5939","Type of area affected=Religious,Weapon System=Unknown"
"CIV1146","06/29/2022","46.962326","31.952514","Mykolaiv","[graphic: dead child buried in rubble] Strike on house reportedly resulted in the death of five people, including a young child. ","https://twitter.com/CyberHellDevil/status/1542172685547053057,https://twitter.com/kAvA240222/status/1542196212459343878,https://www.facebook.com/DSNSMYKOL/posts/pfbid0rM9f5A7Taxw7YTeRxrR3kBig6jXU4b3xzBAqSZM26yLVpiR72aszDCTL7n1k2ywHl,https://24tv.ua/ru/raketnyj-udar-v-nikolaeve-29-06-2022-est-pogibshie-novosti_n2052865,https://www.youtube.com/watch?v=BM04cjoWdos","Type of area affected=Residential,Weapon System=HE rocket artillery"
"CIV1133","06/29/2022","46.962415","31.952552","","Residential house destroyed by shelling.","https://t.me/suspilnemykolaiv/11948,https://t.me/truexanewsua/52381","Type of area affected=Residential,Weapon System=Unknown"
"CIV1165","06/30/2022","48.12319","37.85898","","Explosive damage to a restaurant.","https://t.me/c/1742924192/10508","Type of area affected=Commercial,Weapon System=Unknown"
"CIV1158","06/30/2022","48.857072","37.572352","","damage to civilian vehicle and a religious building. ","HIDDEN","Type of area affected=Religious,Weapon System=Unknown"
"CIV1138","06/30/2022","49.956131","36.271364","","Buildings destroyed by the side of a road. ","https://t.me/hueviykharkov/67170","Weapon System=Unknown"
"CIV1137","06/30/2022","49.883642","36.259062","","Explosion damages woodworking facility. ","https://t.me/hueviykharkov/67200","Type of area affected=Industrial,Weapon System=Unknown"
"CIV1164","07/02/2022","48.938304","38.484176","","Widespread damage to residential and commercial buildings. ","https://t.me/c/1687475640/6122","Type of area affected=Residential,Weapon System=Unknown"
"CIV1151","07/03/2022","48.833583","37.559357","Sloviansk, Donetsk Oblast","Heavy damage to commercial area as a result of reported shelling.","https://twitter.com/DefenceU/status/1543695485759852544,https://m.censor.net/en/photo_news/3351855/as_result_of_sloviansk_shelling_by_russian_occupants_on_july_3_two_children_were_killed_prosecutors,https://censor.net/ua/photo_news/3351918/rosiyiski_snaryady_vbyly_diteyi_na_donechchyni_zadokumentovano_18_udariv_na_dobu_natspolitsiya_videofotoreportaj","Type of area affected=Commercial"
"CIV1151","07/03/2022","48.765478","37.590362","","School damaged as a result of reported shelling.","https://twitter.com/nexta_tv/status/1543710944236380162","Type of area affected=School or childcare,Weapon System=Cluster munitions"
"CIV1152","07/04/2022","48.0426","37.745708","","Market destroyed by strike. Reports claim this may have been an ammunition storage location. ","https://twitter.com/KyleJGlen/status/1544001222629269506,https://twitter.com/IntelCrab/status/1543986262431993858,https://twitter.com/KyleJGlen/status/1544268197209178112,https://twitter.com/KyleJGlen/status/1544268852376256512,https://twitter.com/KyleJGlen/status/1544271231473651713","Type of area affected=Commercial,Weapon System=Unknown"
"CIV1540","07/05/2022","50.002804","36.357699","","Damage to boarding school and large crater.","https://twitter.com/VALMICHEL7/status/1544237110584086529,https://hk.npu.gov.ua/news/STOPRUSSIA/u-xarkovi-chastkovo-zrujnovano-navchalnij-zaklad-slidchi-fiksuyut-naslidki-nichnogo-raketnogo-obstrilu/","Type of area affected=School or childcare,Weapon System=Unknown"
"CIV1539","07/05/2022","48.845721","37.599036","","Explosion at the central market in Slovyansk.","HIDDEN","Type of area affected=Commercial,Weapon System=Unknown"
"CIV1166","07/05/2022","48.395961","37.881544","","School destroyed by explosion. ","https://t.me/c/1687475640/6447?single","Type of area affected=School or childcare,Weapon System=Unknown"
"CIV1153","07/05/2022","47.990351","37.807559","Donetsk","[graphic: child's body under sheet, blood] child reportedly killed after strike in Donetsk city.","https://t.me/reactiv_dnr/9131","Weapon System=Unknown"
"CIV1537","07/06/2022","50.019215","36.317953","","Kharkiv Pedagogical Institute destroyed by shelling.","https://twitter.com/lesiavasylenko/status/1544623818639015937","Type of area affected=School or childcare,Weapon System=Unknown"
"CIV1538","07/06/2022","46.661876","32.61178","","Car repair facility on fire in Kherson.","https://twitter.com/bayraktar_1love/status/1544652019960627203","Type of area affected=Commercial,Weapon System=Unknown"
"CIV1168","07/07/2022","48.741633","37.583057","","[Graphic: Shows injured and dead civilians] Residential area hit by explosion.","https://t.me/c/1687475640/6666,https://t.me/c/1687475640/6669,https://t.me/c/1687475640/6686,https://1.frommypc,https://2.frommypc,https://3.frommypc,https://4.frommypc","Type of area affected=Residential,Weapon System=Unknown"
"CIV1167","07/07/2022","48.593902","37.995276","","Residential buildings destroyed by explosion. ","https://t.me/c/1687475640/6633","Type of area affected=Residential,Weapon System=Unknown"
"CIV1545","07/09/2022","48.615352","37.518235","","Supermarket destroyed in small town in Donetsk, large crater. (Source 1: from 0:19) ","https://youtu.be/yPaeJ3JG7y0","Type of area affected=Commercial,Weapon System=Unknown"
"CIV1178","07/09/2022","49.986588","36.235865","Kharkiv","Residential area struck by what is reported to have been a ballistic missile. ","https://twitter.com/maria_avdv/status/1545742962457444353,https://twitter.com/maria_avdv/status/1545774346769145858,https://youtu.be/92k2hGy6gZM","Type of area affected=Residential,Weapon System=Ballistic missile"
"CIV1201","07/10/2022","46.99768","32.46234","","Church destroyed. ","https://t.me/novostiniko/21736","Type of area affected=Religious,Weapon System=Unknown"
"CIV1177","07/10/2022","49.938685","36.25656","Kharkiv","Explosion in a residential area next to a school produces a large crater. One person was reported injured. ","https://twitter.com/maria_avdv/status/1546102252250824705,https://telegraf.com.ua/ukr/harkov/2022-07-10/5710270-rossiya-snova-obstrelyala-kharkov-razrusheny-shkola-i-zhiloy-dom-foto-video,https://t.me/kharkivlife/43432,https://times.kharkiv.ua/2022/07/10/vnochi-rosijski-raketi-zrujnuvali-gimnaziyu-ta-zhitlovij-budinok-u-harkovi-ye-postrazhdalij-foto/,https://www.ukrinform.ua/rubric-ato/3525793-rosiani-vnoci-obstrilali-harkiv-e-poraneni-zrujnovanij-navcalnij-zaklad.html#,https://kharkivoda.gov.ua/news/116490,https://fakty.com.ua/ua/ukraine/20220710-u-harkovi-pid-chas-povitryanoyi-tryvogy-vnochi-chuly-vybuhy/,https://2day.kh.ua/ua/kharkow/rosiyany-vdaryly-raketamy-po-himanziyi-ta-budynku-v-kharkovi,https://twitter.com/maria_avdv/status/1546102252250824705,https://twitter.com/Beltrew/status/1546050601619955712,https://ok.ru/kelnklnkll/topic/154801729009081,https://kharkov.comments.ua/news/war/2022/12103-voyska-rf-obstrelyali-harkov-kuda-i-v-kogo-popali-foto.html","Type of area affected=School or childcare,Weapon System=Unknown"
"CIV1192","07/10/2022","48.018651","37.846281","","Building destroyed by fire.","https://t.me/itsdonetsk/21143,https://t.me/itsdonetsk/21169","Type of area affected=Commercial,Weapon System=Unknown"
"CIV1163","07/10/2022","48.556424","37.822905","","Strike on residential apartment complex results in multiple civilian fatalities.","https://twitter.com/FrancescaEbel/status/1546133377639759880,https://twitter.com/suspilne_news/status/1546064823238148096,https://twitter.com/Mike_Eckel/status/1546384335565103106,https://twitter.com/loogunda/status/1546087798368788481,https://twitter.com/Flash43191300/status/1546374800830087170,https://twitter.com/loogunda/status/1546090051343376385,https://www.bbc.co.uk/news/world-europe-62113185","Type of area affected=Residential,Weapon System=Unknown"
"CIV1161","07/10/2022","49.9772","36.259365","","School destroyed by strike.","https://twitter.com/zav_raya/status/1546446762117939202,https://twitter.com/Beltrew/status/1546032102935875585,https://twitter.com/suspilne_news/status/1546041772089958400","Type of area affected=School or childcare,Weapon System=Unknown"
"CIV1199","07/11/2022","48.592772","37.996156","","Sports stadium damaged by explosion.","https://t.me/c/1687475640/7027,https://t.me/c/1687475640/7033","Type of area affected=Cultural,Weapon System=Unknown"
"CIV1200","07/11/2022","49.998179","36.273327",""," [Graphic: One of the images shows what appear to be human remains inside a destroyed vehicle] Explosions destroy civilian vehicles and buildings in a commercial area.","https://t.me/c/1742924192/11598","Type of area affected=Commercial,Weapon System=Unknown"
"CIV1179","07/11/2022","49.987957","36.235963","","Rocket strikes reported on Kharkiv, appear to have impacted residential area.","https://t.me/ukraine_now_eng/29149,https://twitter.com/maria_avdv/status/1546482046914248704,https://t.me/ukraine_now_eng/29149","Type of area affected=Residential,Weapon System=Unknown"
"CIV1542","07/12/2022","47.66777","36.25515","","Center for children's and youth creativity shelled. ","https://www.facebook.com/groups/350205398793325/posts/1414343122379542/","Type of area affected=Cultural,Weapon System=Unknown"
"CIV1541","07/12/2022","46.972857","31.975687","","Shelling damage to hospital in Mykolaiv.","HIDDEN","Type of area affected=Healthcare,Weapon System=Unknown"
"CIV1189","07/12/2022","48.398493","37.845008","","Kindergarten destroyed by explosion.","https://t.me/c/1687475640/7094,https://t.me/c/1687475640/7110","Type of area affected=School or childcare,Weapon System=Unknown"
"CIV1191","07/12/2022","48.347211","38.058881","","Kindergarten damaged by explosion. ","https://t.me/itsdonetsk/21428,https://t.me/itsdonetsk/21433","Type of area affected=School or childcare,Weapon System=Unknown"
"CIV1190","07/12/2022","48.346868","38.056511","","[Graphic: Blood and deceased person] One person killed in an apparent explosion in a commercial area. ","https://www.ruptly.tv/en/videos/20220712-034-DPR-Shelling-in-Gorlovka-left-two-residents-dead-Territorial-Defence-Headquarters-,https://t.me/c/1742924192/11712","Type of area affected=Commercial,Weapon System=Unknown"
"CIV1175","07/12/2022","46.977789","31.977635","Mykolaiv","Strike impacted school and residential area. No reports of injuries. ","https://twitter.com/DRovera/status/1546797323304435718,https://twitter.com/ukr_week_en/status/1546970864079540226,https://www.facebook.com/DSNSMYKOL/posts/pfbid02gNfyunfhVrEFQkdAcNK3VJiLpCCfmWU9nPmyEUJrq2RpySUNTakm8PHNUiBVv64al,https://censor.net/ua/photonews/3353579/raketni_udary_rf_po_mykolayevu_ta_obstrily_oblasti_ryatuvalnyky_dsns_likvidovuyut_naslidky_videofotoreportaj,https://x.com/DRovera/status/1546797323304435718","Type of area affected=Undefined,Type of area affected=Residential,Weapon System=Unknown"
"CIV1543","07/13/2022","46.757727","33.376146","","Shops in Nova Kakhovka destroyed and damaged, reportedly as a result of the shelling of a Russian ammunition depot. (Source 1: 0:22-1:42)","https://twitter.com/Cosmonaut19/status/1547269654992736256","Type of area affected=Commercial,Weapon System=Ballistic missile"
"CIV1186","07/14/2022","48.82892","37.546054","Slovyansk, Donetsk Oblast","Children's home heavily damaged in reported attack. ","https://t.me/c/1687475640/7240,https://t.me/c/1687475640/7240","Type of area affected=School or childcare,Weapon System=Unknown"
"CIV1193","07/14/2022","47.987768","37.798596","","[Graphic: covered bodies, blood] Attack near the Tsentr Bus Station, resulting in at least one death and several reported injuries","https://twitter.com/Cosmonaut19/status/1549438953576865793","Type of area affected=Roads/Highways/Transport,Weapon System=Unknown"
"CIV1188","07/14/2022","46.965897","32.002067","","Shopping mall, hotel and other buildings damaged by explosions.","https://t.me/novostiniko/22044","Type of area affected=Commercial,Weapon System=Unknown"
"CIV1185","07/14/2022","46.996412","32.001021","","Building at school destroyed by missile.","https://t.me/ukraine_now_eng/29698,https://t.me/truexanewsua/53910,https://t.me/ukraine_now_eng/29702,https://t.me/ukraine_now_eng/29689","Type of area affected=School or childcare,Weapon System=Unknown"
"CIV1187","07/14/2022","48.859721","37.571015","","Residential buildings damaged and destroyed by explosions. ","https://t.me/c/1687475640/7194,https://mypc.downloads","Type of area affected=Residential,Weapon System=Unknown"
"CIV1169","07/14/2022","49.239303","28.49237","","[Graphic: Some of the images show mutilated dead bodies, including those of children] Commercial area, including a theater, hit by missiles. Reports of at least one dozen civilians killed.","https://twitter.com/SESU_UA/status/1547523614446075904,https://t.me/vorposte/24436?single,https://t.me/vorposte/24434,https://twitter.com/DefenceU/status/1547511988288475137,https://twitter.com/nexta_tv/status/1547530135427076097,https://twitter.com/TanyaKozyreva/status/1547502370820706304,https://twitter.com/BackAndAlive/status/1547515509083709442,https://twitter.com/TWMCLtd/status/1547519252344836098,https://t.me/u_now/57935,https://t.me/vorposte/24452,https://twitter.com/DmytroKuleba/status/1547514695694835712,https://t.me/u_now/57920,https://twitter.com/HannaLiubakova/status/1547684738453762048,https://twitter.com/TWMCLtd/status/1547519252344836098,https://twitter.com/igorlachen/status/1547520690617720833,https://twitter.com/HannaLiubakova/status/1547684308160090113,https://twitter.com/home,https://t.me/u_now/57924,https://t.me/u_now/57888,https://twitter.com/KaterynaZarembo/status/1547523679722127360,https://twitter.com/sternenko/status/1547517395534860288,https://twitter.com/uawarinfo/status/1547686804630818819","Type of area affected=Commercial,Weapon System=Cruise missile"
"CIV1170","07/14/2022","46.965427","32.002118","","Business center/hotel shelled in central Mykolaiv. Damage to upper floors.","https://t.me/senkevichonline/1646,https://www.facebook.com/DSNSMYKOL/posts/pfbid02sVZJV6XPESks9rf4JFmtwYiy2ro514WC7mDdqS4m559zYLGGYiV4bGq1Jxk29JGzl,https://news.pn/ru/RussiaInvadedUkraine/275204,https://www.youtube.com/watch?v=2YVkcjJ9ZGo,https://twitter.com/vitalij_kim/status/1547514825626062850","Type of area affected=Commercial,Weapon System=Unknown"
"CIV1182","07/15/2022","48.739057","37.584879","","Parachute-retarded bomb impacted outside Palace of Culture and Technology.","https://twitter.com/GirkinGirkin/status/1548024777826193411","Type of area affected=Cultural,Weapon System=Air strike"
"CIV1194","07/15/2022","48.438783","34.995091","","Attack on what appears to be a residential area. Air defense missile incoming, explosion, and several cars on fire in the aftermath of the strike.","https://twitter.com/AbderRaoufAmir/status/1548067234223759364,https://twitter.com/o_smishko/status/1548030459010957313,https://t.me/milinfolive/87067","Type of area affected=Residential,Weapon System=Unknown"
"CIV1171","07/15/2022","48.588675","37.967283","Bakhmut","Attack on a reported grocery store.","https://t.me/truexanewsua/54103","Type of area affected=Commercial,Weapon System=Unknown"
"CIV1172","07/15/2022","46.987465","32.001217","Nikolaev","University building damaged by explosion.","https://t.me/truexanewsua/54069,https://t.me/truexanewsua/54068,https://lb.ua/society/2022/07/15/523234_rosiya_atakuvala_dva_naybilshih.html,https://www.facebook.com/infocenterNUK/posts/pfbid0CEdU3KA4P8VKgKdvCdc7tGhqRDQ6WWFzRMgXbonoWovb5o5x6JRHXxBXMbDtHLLPl,https://t.me/truexanewsua/54069,https://t.me/truexanewsua/54069,https://t.me/truexanewsua/54068","Type of area affected=School or childcare,Weapon System=Unknown"
"CIV1544","07/16/2022","49.84062","36.692971","","Damage after strike in Chuhuiv.","https://www.facebook.com/MNS.GOV.UA/posts/pfbid0NH4BECEdm9Hjvo9U6jYMB7jR2LE6CYVeKn2ghFZzJkKyYmznWbNJxaoN3JXczoMol,https://twitter.com/Flash43191300/status/1548183911200501760","Type of area affected=Residential,Weapon System=Unknown"
"CIV1196","07/18/2022","47.018347","31.995599","","M Motors, Renault dealership damaged and with a crater in the car park","https://twitter.com/TpyxaNews/status/1548943158238666752","Type of area affected=Commercial,Weapon System=Unknown"
"CIV1184","07/18/2022","48.392023","37.846371","","Building in residential area struck. Reportedly 6 fatalities and two wounded. ","https://twitter.com/SESU_UA/status/1548952963783299073","Type of area affected=Residential,Weapon System=Unknown"
"CIV1215","07/19/2022","46.669429","32.720357","","Antonovskiy bridge damaged by missiles.","https://t.me/truexanewsua/54531","Type of area affected=Roads/Highways/Transport,Weapon System=HE rocket artillery"
"CIV1213","07/20/2022","50.02274","36.319074","","[Graphic:Videos and pictures show uncovered dead bodies lying on the street] Aftermath of a shelling in a residential area","https://t.me/truexanewsua/54636,https://t.me/truexanewsua/54644,https://t.me/truexanewsua/54651,https://twitter.com/ngumenyuk/status/1549851295233753088,https://twitter.com/zaborona_media/status/1550162129445167104/photo/1","Type of area affected=Residential,Weapon System=Unknown"
"CIV1195","07/20/2022","50.022697","36.318913","","Multiple casualties after shelling of bus station in Kharkiv","https://kh.vgorode.ua/ukr/news/sobytyia/a1213624-zjavilisja-foto-z-mistsja-rankovoho-obstrilu-kharkova-20-lipnja","Type of area affected=Residential,Weapon System=Unknown"
