"id","date","latitude","longitude","location","description","sources","associations"
"CIV1956","03/24/2023","51.145418","34.309472","Bilopillya, Sumy Oblast","Residential area heavily damaged after a reported overnight strike.","https://t.me/huyovy_kharkiv/104043","Type of area affected=Residential,Weapon System=Loitering munition,Weapon System=Air strike"
"HIQLAB","03/26/2023","49.723785","37.606488","Kupyansk (Kharkiv region)

","Damage to a house as a result of shelling.","https://www.facebook.com/prokuraturakharkiv/posts/pfbid058J9pVoYAtYgeWtTH36gAVKzG9cz7mChwNUA6aU92wLNs5QnDbA9J2M9AQLsHSMFl,https://www.objectiv.tv/objectively/2023/03/26/armiya-rf-udarila-po-kupyansku-est-razrusheniya-informatsiya-gschs-foto/","Type of area affected=Residential"
"CIV1958","03/26/2023","48.735995","37.588106","Kramatorks (Donetsk region)","Damage to what appears to be university building, as well as neighboring apartment buildings as a result of strike.","https://twitter.com/den_kazansky/status/1639869322691575809","Type of area affected=Residential,Type of area affected=Administrative,Type of area affected=School or childcare,Weapon System=Anti-air missile"
"CIV1960","03/26/2023","46.789582","33.337829","Kozatske (Kherson region)","Massive damage to what appears to be a school as a result of strike.","https://t.me/hueviyherson/37082","Type of area affected=School or childcare,Weapon System=Unknown"
"CIV1961","03/26/2023","49.721504","37.600575","Kupyansk (Kharkiv region)","Damage to what appears to be apartment building as a result of shelling.","HIDDEN","Type of area affected=Residential,Weapon System=Unknown"
"CIV1962","03/27/2023","48.855113","37.616194","Sloviansk (Donetsk region)","Strike on what appears to be residential area. At least 2 people reported dead, 29 injured. ","https://twitter.com/maria_avdv/status/1640306844466855936,https://www.usatoday.com/videos/news/nation/2023/03/27/russian-shelling-hits-ukrainian-city-sloviansk/11548704002/","Type of area affected=Residential,Weapon System=Anti-air missile"
"CIV1959","03/27/2023","48.625562","37.564717","Druzhkivka (Donetsk region)","Damage to a boarding school as a result of a reported strike.","https://t.me/pavlokyrylenko_donoda/7269","Type of area affected=School or childcare,Type of area affected=Residential,Weapon System=Anti-air missile"
"CIV1970","03/28/2023","50.168873","35.521707","Bohodukhiv, Kharkiv Region","Aftermath of the strike on a residential building and kindergarten in a rural area.","https://t.me/h_saltovka/74788,https://www.ukrinform.ua/rubric-regions/3688643-raketnij-udar-po-bogoduhovu-poskodzeni-budinki-j-ditsadok-colovik-otrimav-kontuziu.html,https://www.ukrinform.ua/rubric-regions/3688643-raketnij-udar-po-bogoduhovu-poskodzeni-budinki-j-ditsadok-colovik-otrimav-kontuziu.html,https://www.ukrinform.ua/rubric-regions/3688643-raketnij-udar-po-bogoduhovu-poskodzeni-budinki-j-ditsadok-colovik-otrimav-kontuziu.html,https://www.ukrinform.ua/rubric-regions/3688643-raketnij-udar-po-bogoduhovu-poskodzeni-budinki-j-ditsadok-colovik-otrimav-kontuziu.html,https://delo.ua/incidents/armiya-rf-zavdala-raketnogo-udaru-po-bogoduxivu-poskodzeno13-zitlovix-budinkiv-ta-dityacii-sadok-413743/,https://delo.ua/incidents/armiya-rf-zavdala-raketnogo-udaru-po-bogoduxivu-poskodzeno13-zitlovix-budinkiv-ta-dityacii-sadok-413743/","Type of area affected=Residential,Type of area affected=School or childcare"
"CIV1968","03/28/2023","46.656955","32.607897","Kherson","Ukrposhta building in Kherson damaged in reported overnight shelling.","https://t.me/olexandrprokudin/174,https://t.me/hueviyherson/37156,https://www.pravda.com.ua/eng/news/2023/03/28/7395376/,https://suspilne.media/429462-rosijski-vijska-obstrilali-deokupovane-pravoberezza-hersonsini-ta-oblasnij-centr/","Type of area affected=Administrative"
"CIV1969","03/28/2023","46.662254","32.651194","Kherson","Hospital in Kherson reportedly shelled overnight. ","https://t.me/hueviyherson/37150,https://mobile.twitter.com/Flash_news_ua/status/1640632424991162369","Type of area affected=Healthcare"
"CIV1971","03/29/2023","50.168149","35.520645","Kharkiv Region","Destroyed rural residential houses and an impact crater.","https://t.me/h_saltovka/74816","Type of area affected=Residential,Weapon System=Unknown"
"CIV1973","03/31/2023","49.978993","36.202429","Kharkiv (Novobavar district)","Residential housing damaged by a reported S300 strike.","https://t.me/truexakharkiv/25745,https://t.me/truexakharkiv/25743,https://t.me/huyovy_kharkiv/104735,https://www.youtube.com/watch?v=tyzwuzCDUvE","Type of area affected=Residential,Weapon System=Anti-air missile"
"CIV1974","03/31/2023","47.75148","35.138479","Zaporizhzhia","Kindergarten and residential housing damaged as a result of what is reported to be an overnight strike. Large crater is visible.","https://t.me/ssternenko/14664,https://war.novyny.live/naslidki-obstriliv-peredmistia-zaporizhzhia-iermak-opublikuvav-video-85129.html","Type of area affected=Residential,Weapon System=Unknown"
"CIV2042","04/03/2023","46.847752","33.428663","Beryslav, Kherson Oblast","Warehouses heavily damaged in reported airstrike.","https://t.me/c/1468918019/10803,https://t.me/c/1468918019/10803,https://t.me/hersontshina/3939,https://rubryka.com/2023/04/03/na-hersonshhyni-vorozhi-vijska-kerovanymy-aviabombamy-vdaryly-po-pidpryyemstvu-v-beryslavskomu-rajoni/,https://t.me/olexandrprokudin/210","Type of area affected=Industrial,Weapon System=Air strike"
"CIV1982","04/03/2023","47.56507","35.790538","Orikhiv, Zaporizhzhia Oblast","Heavy damage to schools as a result of a reported airstrike.","https://t.me/suspilnezaporizhzhya/11863,https://www.facebook.com/photo.php?fbid=597670775725999&set=pcb.597670899059320&type=3&theater","Type of area affected=School or childcare"
"CIV1979","04/03/2023","46.84507","33.421887","Beryslav, Kherson Oblast","Warehouse and football stadium in a residential area damaged in a reported attack.","https://t.me/c/1468918019/10035,https://t.me/ermaka2022/2372","Type of area affected=Industrial,Weapon System=Air strike"
"CIV1978","04/03/2023","46.699913","32.587288","Stepanivka, Kherson Oblast","Psychiatric hospital damaged as a result of reported shelling.","https://t.me/hueviyherson/37450,https://suspilne.media/434844-rosijski-vijska-obstrilali-psihiatricnu-likarnu-na-hersonsini/,https://t.me/hueviyherson/37506","Type of area affected=Healthcare,Weapon System=Unknown"
"CIV1980","04/04/2023","47.986499","37.274613","Kurakhovo, Donetsk region","Store and other civilian buildings damaged by explosion.","https://t.me/hyevuy_dnepr/49484,https://censor.net/en/photo_news/3410070/russian_occupiers_launched_massive_attack_on_kurakhove_at_night_photos,https://www.youtube.com/watch?v=mp4YjVB5S_E","Type of area affected=Healthcare,Type of area affected=Commercial,Type of area affected=Administrative"
"CIV1991","04/07/2023","46.828603","33.407823","Beryslav, Kherson region","School reportedly damaged in airstrike.","https://t.me/khersonskaODA/4984,https://censor.net/ua/photo_news/3410923/rashysty_vdaryly_aviatsiyinymy_bombamy_po_seredmistyu_beryslava_ova_foto","Type of area affected=School or childcare"
"CIV1992","04/08/2023","46.840354","33.435333","Beryslav, Kherson region","Grain elevator heavily damaged in reported airstrike.","https://t.me/khersonskaODA/5005,https://gordonua.com/news/war/okkupanty-razbombili-elevator-v-berislave-v-hersonskoy-ova-pokazali-posledstviya-aviaudara-foto-1658680.html,https://unt.ua/news-derzhava-rehiony-ukrayiny/125377-vchora-vvecher-ros-ys-ka-av-ac-ya-skinula-vibuh-vku-na-elevator-u-berislav.html","Type of area affected=Food/Food Infrastructure"
"CIV1989","04/10/2023","46.826077","33.403376","Beryslav, Kherson region","Residential houses heavily damaged in reported airstrikes. ","https://t.me/c/1468918019/10196,https://www.ukrinform.net/rubric-ato/3694387-russian-aircraft-launch-strikes-on-beryslav-many-houses-destroyed.html,https://liveuamap.com/en/2023/11-april-widespread-damage-in-beryslav-after-russian-airstrikes,https://t.me/khersonskaODA/5051,https://www.youtube.com/watch?v=FzKbonGC8Zo&t=56s&ab_channel=%D0%A2%D0%A1%D0%9D","Type of area affected=Residential"
"CIV1988","04/11/2023","46.628647","32.616081","Kherson","Church damaged in reported shelling.","https://t.me/c/1468918019/10194,https://www.pravda.com.ua/news/2023/04/11/7397350/,https://www.youtube.com/watch?v=IzfyIyNiUEQ,https://t.me/khersonskaODA/5050,https://www.unian.ua/war/velikden-2023-naperedodni-svita-rosiyani-obstrilyali-cerkvu-u-hersoni-12214170.html","Type of area affected=Religious"
"CIV1997","04/14/2023","48.859056","37.575343","Slovyansk","[Graphic: body of a child visible] Heavy damage to what appears to be a residential building. At least 15 people reported dead (including 2 y.o. child), 24 injured.","https://t.me/c/1660608608/8615,https://t.me/c/1660608608/8622,https://t.me/huyovy_kharkiv/106173,https://t.me/huyovy_kharkiv/106172,https://t.me/huyovy_kharkiv/106171,https://t.me/huyovy_kharkiv/106166,https://t.me/h_saltivka/75731,https://t.me/h_saltivka/75737,https://t.me/h_saltivka/75739,https://t.me/h_saltivka/75740,https://t.me/h_saltivka/75768,https://t.me/huyovy_kharkiv/106241,https://t.me/Donbas_Operativniy/35258,https://twitter.com/DefenceU/status/1647201157859663872","Type of area affected=Residential"
"CIV2001","04/15/2023","50.291287","36.928713","Vovchansk (Kharkiv region)","Damage to what appears to be a hospital and neighboring residential buildings as a result of shellings.","https://t.me/synegubov/5949,https://twitter.com/ukrpravda_news/status/1647117641268490240","Type of area affected=Residential,Type of area affected=Healthcare,Weapon System=Unknown"
"CIV1998","04/15/2023","46.671276","32.613082","Kherson","[Graphic: blood visible, body bags, blurred bodies] What appears to be civilians killed in the area of a school district.","https://t.me/hueviyherson/38025,https://t.me/hueviyherson/38031","Type of area affected=Residential,Type of area affected=School or childcare"
"CIV2003","04/16/2023","48.010555","37.808179","Donetsk","[Graphic: Bodies visible] Central market and church shelled during overnight Easter church service.","https://t.me/WarDonbass/107533,https://t.me/SolovievLive/171635,https://t.me/vorposte/38564,https://t.me/c/1410361541/43079,https://t.me/RtrDonetsk/16702,https://t.me/truexanewsua/71700,https://t.me/RtrDonetsk/16696,https://t.me/c/1687475640/27213","Type of area affected=Commercial,Type of area affected=Religious,Type of area affected=Food/Food Infrastructure,Weapon System=Cluster munitions"
"CIV2000","04/16/2023","47.069935","32.787915","Snihurivska (Mykolaiv region)","[Graphic: bodies visible] Two teenagers reported dead as a result of shelling.","https://t.me/trkmart/19255","Type of area affected=School or childcare,Weapon System=Anti-air missile"
"CIV2002","04/16/2023","47.716598","35.521312","Komyshuvakha (Zaporizhzhia region)","Damage to what appears to be a church and neighboring residential buildings as a result of shelling.","https://t.me/info_zp/33241,https://t.me/info_zp/33216,https://nikopolnews.net/region/komyshuvakhu-na-zaporizhzhi/","Type of area affected=Residential,Type of area affected=Religious,Weapon System=Unknown"
"CIV1999","04/16/2023","48.133018","37.736051","Avdiivka (Donetsk region)","Damage to residential buildings a a result of shelling.","https://t.me/huyovy_kharkiv/106448?single,https://t.me/wargonzo/12008","Type of area affected=School or childcare,Weapon System=Unknown"
"CIV2013","04/18/2023","50.294446","36.933089","Vovchansk (Kharkiv region)","Aftermath of a reported strike on a residential area near a school; two people reportedly killed.","https://t.me/prokuratura_kharkiv/8718,https://t.me/nexta_live/50744","Type of area affected=Residential,Type of area affected=School or childcare,Weapon System=Unknown"
"CIV2006","04/18/2023","47.627071","34.506963","Chervonohryhorivka, Nikopol, Dnipropetrovsk Oblast","Private homes, solar panels, and greenhouses damaged in reported shelling.","https://t.me/hyevuy_dnepr/50550,https://t.me/dnipropetrovskaODA/4187,https://t.me/dnipro_now/39396,https://antikor.com.ua/ru/articles/623164-okkupanty_obstreljali_nikopoljskij_rajon_i_povredili_chastnoe_predprijatie,https://www.nikopolpravda.com.ua/?p=13143,https://t.me/mykola_lukashuk/4175","Type of area affected=Residential,Type of area affected=Food/Food Infrastructure,Type of area affected=Industrial"
"CIV2008","04/18/2023","46.63873","32.606216","Kherson, Kherson Oblast","[Graphic: Bodies, blood visible] One person reported killed, 9 injured in shelling of market.","https://t.me/hueviyherson/38143,https://t.me/hueviyherson/38141,https://t.me/hueviyherson/38139,https://t.me/pgo_gov_ua/11339","Type of area affected=Commercial"
"CIV2009","04/18/2023","48.094758","37.362628","Ukrainsk, Donetsk Oblast","Market and residential houses reportedly shelled; at least 8 people injured.","https://t.me/suspilnedonbas/12662,https://t.me/pavlokyrylenko_donoda/7603,https://www.ukrinform.ua/rubric-ato/3697479-rosiani-obstrilali-rinok-v-ukrainsku-sonajmense-10-poranenih.html","Type of area affected=Commercial,Type of area affected=Residential"
"CIV2014","04/19/2023","46.668164","32.645929","Kherson","Reported strike on a bus station.","https://t.me/hueviyherson/38176,https://t.me/FastFocus/47648,https://t.me/c/1206076820/38176","Type of area affected=Commercial,Weapon System=Unknown"
"CIV2011","04/19/2023","46.375983","30.737764","Odesa","Building in children's health-sports complex on fire after reported strike.","https://t.me/truexanewsua/71815,https://twitter.com/revishvilig/status/1648562333847789570,https://twitter.com/nexta_tv/status/1648560500572028928","Type of area affected=School or childcare,Weapon System=Unknown"
"CIV2016","04/23/2023","46.564157","32.356527","Kizomys, Kherson Oblast","School heavily damaged in a reported strike.","https://t.me/c/1468918019/10470,https://gordonua.com/ukr/news/war/okupanti-z-pochatku-vijni-zrujnuvali-abo-poshkodili-ponad-200-osvitnih-zakladiv-u-hersonskij-oblasti-ova-1660909.html,https://www.facebook.com/100003053213856/videos/184910774425592/","Type of area affected=School or childcare"
"CIV2020","04/24/2023","47.588123","35.366824","Zaporizhzhia","Aftermath of reported strikes; two people reportedly wounded.","https://t.me/suspilnezaporizhzhya/12354,https://suspilne.media/456144-protagom-minuloi-dobi-armia-rf-zavdala-ponad-100-udariv-po-zaporizkij-oblasti-e-poraneni/,https://zp.npu.gov.ua/news/obstriliani-budynky-ta-punkt-nadannia-humdopomohy-naslidky-zbroinoi-ataky-na-zaporizhzhi-zadokumentuvaly-politseiski","Type of area affected=Undefined,Weapon System=Unknown"
"CIV2017","04/24/2023","47.85948","36.998919","Shakhtarsk","[Graphic: Bodies visible, blood visible] Two people killed in a reported strike on a residential area.","https://t.me/pgo_gov_ua/11529","Type of area affected=Residential,Weapon System=Unknown"
"CIV2018","04/25/2023","49.714221","37.610727","Kupyansk, Kharkiv Oblast","[Graphic: Body visible] Museum damaged in a reported strike; at least 2 people killed, multiple injured.","https://t.me/hyevuy_dnepr/50926,https://t.me/hyevuy_dnepr/50901,https://t.me/ermaka2022/2503,https://t.me/huyovy_kharkiv/107268,https://t.me/pgo_gov_ua/11544,https://t.me/c/1412784313/29644,https://t.me/kharkivlife/59999,https://t.me/c/1006836030/82150,https://t.me/c/1006836030/82170","Type of area affected=Cultural"
"CIV2021","04/27/2023","46.97241","32.004549","Mykolaiv","Aftermath of reported shelling in Mykolaiv.","https://t.me/Donbas_Operativniy/36484,https://t.me/Donbas_Operativniy/36477,https://t.me/huyovy_kharkiv/107470","Type of area affected=Residential"
"CIV2024","04/28/2023","48.021135","37.796549","Donetsk","[Graphic: Blood, injury] 9 reported dead after a strike on central Donetsk.","https://t.me/Doninside/18435,https://t.me/wargonzo/12206,https://t.me/c/1687475640/27845,https://t.me/c/1743148536/38179,https://t.me/Doninside/18432","Type of area affected=Residential,Type of area affected=Commercial,Weapon System=HE rocket artillery"
"CIV2022","04/28/2023","48.403639","35.042764","Dnipro","One woman and child reported as killed after a strike on Dnipro.","https://t.me/dsns_telegram/16335,https://t.me/pgo_gov_ua/11625","Type of area affected=Commercial,Weapon System=Unknown"
"CIV2023","04/28/2023","48.766768","30.217453","Uman, Cherkasy oblast","[Graphic: covered dead bodies]20 people reported as killed after what is reported to be a missile attack.","https://t.me/uniannet/96614,https://t.me/uniannet/96605,https://t.me/uniannet/96593,https://t.me/uniannet/96571,https://t.me/c/1352726486/53494,https://t.me/c/1352726486/53473,https://twitter.com/UKR_token/status/1651934209710202882","Type of area affected=Residential,Weapon System=Unknown"
"CIV2026","04/30/2023","46.652334","32.607889","Kherson","Damage to Kherson Cooperative Economic and Legal College as a result of reported shelling.","https://t.me/hueviyherson/38649,https://web.archive.org/web/20230430070656/https://t.me/hueviyherson/38649","Type of area affected=School or childcare,Type of area affected=Residential,Weapon System=Unknown"
"269UDV","05/02/2023","51.949146","33.931571","Sumy","Educational institution destroyed ay anti-aircraft fire.","https://t.me/news_sumy24/45101","Type of area affected=Cultural,Weapon System=Anti-air missile"
"CIV2028","05/03/2023","46.658622","32.569283","Kherson","[Graphic. Bodies visible.] Strike at what appears to be a hypermarket. At least three people reported dead, five injured.","https://t.me/hueviyherson/38826,https://t.me/hueviyherson/38827,https://t.me/hueviyherson/38830,https://t.me/hueviyherson/38835,https://t.me/huyovy_kharkiv/108107,https://t.me/huyovy_kharkiv/108143","Type of area affected=Commercial"
"CIV2029","05/03/2023","46.656071","32.606908","Kherson","[Graphic. Bodies visible.] Kherson aftermath of shelling around the train station. At least 23 people reported dead, 46 injured, including 2 children.","https://t.me/hueviyherson/38883,https://t.me/hueviyherson/38876,https://t.me/hueviyherson/38874,https://t.me/hueviyherson/38863,https://t.me/hueviyherson/38856,https://t.me/hueviyherson/38887,https://t.me/hueviyherson/38888,https://t.me/hueviy_kherson/502,https://t.me/hueviy_kherson/512,https://t.me/hueviy_kherson/522","Type of area affected=Commercial"
"CIV2040","05/05/2023","51.691729","33.895295","Hlukhiv, Sumy Oblast","Five people, including a 12-year-old girl, injured in reported airstrike on residential areas.","https://t.me/pgo_gov_ua/11891,https://zaxid.net/okupanti_vdarili_aviabombami_po_privatnih_budinkah_u_gluhovi_n1563032,https://zaxid.net/okupanti_vdarili_aviabombami_po_privatnih_budinkah_u_gluhovi_n1563032","Type of area affected=Residential,Type of area affected=School or childcare"
"CIV2035","05/08/2023","46.565479","32.146993","Stanislav, Kherson","Ten people, including a 9-year-old, injured in reported shelling of residential areas.","https://t.me/hueviyherson/39153,https://t.me/hueviyherson/39175","Type of area affected=Residential,Type of area affected=Commercial"
"CIV2034","05/08/2023","50.425276","30.382765","Kyiv","Residential building damaged with what appears to be a debris of a loitering munition. At least 2 people reported injured.","https://t.me/huyovy_kharkiv/108653,https://www.youtube.com/watch?v=92zM728wsCE&t=49s","Type of area affected=Residential"
"CIV2048","05/11/2023","46.631263","32.617295","Kherson, Kherson Oblast","School on fire as a result of reported shelling.","https://t.me/truexakhersonua/31750,https://t.me/truexakhersonua/31748,https://most.ks.ua/news/url/vnaslidok-rosijskogo-obstrilu-v-hersoni-palaje-istorichna-budivlja/#:~:text=%D0%91%D1%83%D0%B4%D1%96%D0%B2%D0%BB%D1%8F%20%D0%BC%D1%96%D1%81%D1%8C%D0%BA%D0%BE%D1%97%20%D0%B3%D1%96%D0%BC%D0%BD%D0%B0%D0%B7%D1%96%D1%97%20%E2%84%96%2020,%D0%BC%D0%B0%D1%94%20%D1%81%D1%82%D0%B0%D1%82%D1%83%D1%81%20%D0%BF%D0%B0%D0%BC'%D1%8F%D1%82%D0%BA%D0%B8%20%D1%96%D1%81%D1%82%D0%BE%D1%80%D1%96%D1%97.,https://t.me/truexakhersonua/31757,https://t.me/truexakhersonua/31808","Type of area affected=School or childcare"
"CIV2047","05/11/2023","47.65484","35.256783","Malokaterynivka, Zaporizhzhia Oblast","Multiple reportedly damaged in heavy shelling of residential areas.","HIDDEN","Type of area affected=Residential"
"CIV2054","05/12/2023","46.631352","32.616922","Kherson","Damage to what appears to be school, hospital, critical infrastructure, etc. as a result of shelling.","https://t.me/hueviy_kherson/659,https://t.me/hueviy_kherson01/659,https://t.me/hueviyherson/39324,https://t.me/hueviy_kherson01/646","Type of area affected=Residential,Type of area affected=School or childcare,Type of area affected=Healthcare,Type of area affected=Roads/Highways/Transport,Weapon System=Unknown"
"7G1JJ0","05/13/2023","48.531192","37.685142","Kostyantynivka (Donetsk region)

","Damage to a petrol station.","https://bellingcat-archive.nyc3.cdn.digitaloceanspaces.com/https-t-me-pavlokyrylenko-donoda-7946/79195744-2f8e-4a.html,https://karachun.com.ua/ru/donbass/38637-2-pogibshih-i-11-ranennih-posledstviya-obstrela-konstantinovki,https://novosti.dn.ua/news/349787-kostyantynivka-potrapyla-pid-potuzhnyj-obstril-dvoye-zagyblyh-11-poranenyh-masovi-rujnuvannya","Type of area affected=Roads/Highways/Transport"
"CIV2052","05/13/2023","48.535012","37.697178","Kostyantynivka (Donetsk region)","Damage to what appears to be residential area as a result of shelling. At least two people reported dead (including one child), 11 injured.","https://t.me/pavlokyrylenko_donoda/7946,https://t.me/pgo_gov_ua/12125,https://karachun.com.ua/ru/donbass/38637-2-pogibshih-i-11-ranennih-posledstviya-obstrela-konstantinovki,https://novosti.dn.ua/ru/news/349786-konstantinovka-popala-pod-moshhnyj-obstrel-dvoe-pogibshih-11-ranenyh-massovye-razrusheniya","Type of area affected=Residential,Weapon System=Unknown,Weapon System=Cluster munitions"
"CIV2053","05/14/2023","49.983182","36.204504","Kharkiv","Aftermath of shelling of Novobavarskyi district of the city of Kharkiv.","https://t.me/huyovy_kharkiv/109373?single,https://t.me/huyovy_kharkiv/109357","Type of area affected=Industrial,Type of area affected=Residential,Weapon System=Anti-air missile"
"CIV2049","05/14/2023","49.554386","25.60046","Ternopil","Aftermath of a series of strikes at what appears to be residential area.","https://t.me/c/1248149892/36026,https://twitter.com/LogKa11/status/1657677537915416577,https://twitter.com/Flash_news_ua/status/1657657271780818946,https://twitter.com/Flash_news_ua/status/1657673213898375168,https://twitter.com/mamanga1/status/1657739324199247873,https://twitter.com/eldestapeweb/status/1657732498020012033,https://twitter.com/dragon_of_time_/status/1657729700796551176,https://t.me/ermaka2022/2658","Type of area affected=Residential,Type of area affected=Industrial,Weapon System=Cruise missile"
"CIV2055","05/15/2023","46.675961","32.612644","Kherson","Damage to what appears to be the Kherson Academy of Continuing Education as a result of shelling.","https://t.me/hueviy_kherson/696","Type of area affected=Administrative,Type of area affected=School or childcare,Weapon System=Unknown"
"CIV2051","05/15/2023","48.15069","37.735541","Avdiivka (Donetsk region)","Strike at what appears to be a hospital. At least 4 people reported dead.","https://t.me/StepanychUA/128,https://twitter.com/kardinal691/status/1658069619188301825,https://t.me/suspilnedonbas/13301","Type of area affected=Healthcare,Weapon System=Unknown"
"CIV2071","05/16/2023","46.90455","32.038947","Mykolaiv, Mykolaiv Oblast","At least one person injured in reported airstrike on residential area.","https://t.me/pgo_gov_ua/12216,https://t.me/truexanikolaev/33023,https://t.me/truexanikolaev/33020","Type of area affected=Residential,Type of area affected=Commercial"
"CIV2057","05/16/2023","48.165258","37.70626","Avdiivka, Donetsk Oblast","Chemical plant damaged in reported airstrike.","https://t.me/suspilnedonbas/13337,https://suspilne.media/477757-vijskovi-rf-zavdali-aviaraketnij-udar-po-avdiivskomu-koksohimzavodu/","Type of area affected=Industrial"
"CIV2070","05/17/2023","46.830237","33.40048","Beryslav, Kherson Oblast","Hospital damaged in reported strike.","https://t.me/hueviyherson/39546,https://www.ukrinform.net/rubric-ato/3710345-invaders-strike-hospital-in-beryslav-breaking-windows-and-damaging-walls.html,https://www.yahoo.com/entertainment/russians-strike-hospital-beryslav-apartment-065601834.html,https://t.me/hueviyherson/39553","Type of area affected=Healthcare"
"CIV2065","05/17/2023","48.126871","37.858063","Yasynuvata, Donetsk Region","Residential buildings reportedly damaged by strike; 3 people wounded.","https://t.me/Short_DPR/44302","Type of area affected=Residential,Weapon System=Unknown"
"CIV2066","05/17/2023","48.002828","37.716","Kuibyshevskyi District, Donetsk","Civilian buildings reportedly damaged by a strike.","https://t.me/Short_DPR/44305","Type of area affected=Residential,Type of area affected=Commercial,Weapon System=Unknown"
"CIV2079","05/20/2023","48.394614","37.874011","Toretsk (Donetsk region)","Damage to what appears to be residential area as a result of shelling. At least 5 people reported injured, including 1 child.","https://t.me/pavlokyrylenko_donoda/8056?single,https://twitter.com/KyivIndependent/status/1659965503220187136,https://www.facebook.com/cgb.dzer/posts/pfbid0qR4Fng4VHK2ze4DmzLwhADp1GHvjYnz1aZxYsokq7jiDTXZDPBY6JHMVf1wvV1P9l","Type of area affected=Residential,Type of area affected=Healthcare,Weapon System=Unknown"
"CIV2086","05/21/2023","47.569289","34.883669","Myrivska Territorial Community, Nikopol, Dnipropetrovsk Oblast","Hospital and post office reportedly damaged in shelling of residential area.","https://t.me/Yevtushenko_E/3775,https://t.me/mykola_lukashuk/4659","Type of area affected=Residential,Type of area affected=Administrative,Type of area affected=Cultural,Type of area affected=Healthcare"
